text,badge_color,final_score,model_cred,heur_score,heur_tips,prob_toxic,prob_severe_toxic,prob_obscene,prob_threat,prob_insult,prob_identity_hate,pred_toxic,pred_severe_toxic,pred_obscene,pred_threat,pred_insult,pred_identity_hate
Same. The trust issues I’ve developed from those encounters are insane.,yellow,0.6987940646358766,0.9982772351941094,0.0,,0.0017227648058906198,9.302068792749196e-05,0.0001857942552305758,0.00010780082084238529,0.0002067121968138963,0.00016376393614336848,0,0,0,0,0,0
I'm so sorry that has happened to you. I hope you are in a better place. 👐,yellow,0.6798225717619061,0.9711751025170088,0.0,,0.02882489748299122,0.0005046917940489948,0.0010683886939659715,0.00712123978883028,0.0012606015661731362,0.0011100760893896222,0,0,0,0,0,0
"Its been 7 years, so life moves on. I just feel dumb and shitty at this point. I trusted her when I shouldn't. Never thought people changed.",red,0.4249186247587204,0.607026606798172,0.0,,0.392973393201828,0.0023636759724467993,0.3330419659614563,0.0007423981442116201,0.027540970593690872,0.0011837645433843136,0,0,0,0,0,0
"Don't put yourself down for trying to see the best in people. She was the shitty one for lying to you. As long as you've learned from this experience and grew, then all's well.",red,0.24094251394271848,0.3442035913467407,0.0,,0.6557964086532593,0.0037061769980937243,0.4905818998813629,0.0009637415641918778,0.15590800344944,0.0022549391724169254,1,0,0,0,0,0
It’s up to you on whether you want to look past this or stop being friends with him. Cutting someone off due to their personal choices not aligning with your ethics is a very normal thing to do.,yellow,0.6987504069576971,0.9982148670824245,0.0,,0.0017851329175755382,9.494332334725186e-05,0.000201200891751796,0.00012180143676232547,0.00021596465376205742,0.00015796783554833382,0,0,0,0,0,0
"Consider that if you continue to hang out with him, you may be in the room when the gunfight starts up. So ... don't ever stand or sit near him, especially in public venues.",yellow,0.6940247708000242,0.991463958285749,0.0,Repeated punctuation.,0.008536041714251041,0.0001262532314285636,0.00046910461969673634,0.00034796175896190107,0.0004284069000277668,0.00027423471328802407,0,0,0,0,0,0
"he’s a POS, as are the women cheating.",red,0.08952403664588927,0.12789148092269897,0.0,,0.872108519077301,0.004119445104151964,0.24810142815113068,0.0005136648542247713,0.44240492582321167,0.008178447373211384,1,0,0,0,0,0
Fuck them cheaters - taken literally,red,0.0011151373386383055,0.0015930533409118652,0.0,,0.9984069466590881,0.4477177560329437,0.9929044842720032,0.00460688816383481,0.9259709715843201,0.022453797981142998,1,0,1,0,1,0
"I’ve always been of the mindset that you are as good as the company you keep. Some people disagree and that’s okay. However I know that if my closest buddy was sleeping with married or committed women, I would ditch him, and I know he’d do the same thing if I did it. He’s the one I go to when I got moral questions or when I need advice so It’s needed I can trust his overall moral judgement.",yellow,0.6964527511037886,0.9949325015768409,0.0,,0.0050674984231591225,0.00010907981777563691,0.0004903864464722574,0.00013452015991788357,0.00036265747621655464,0.00021140911849215627,0,0,0,0,0,0
"Thanks. My mind is pretty set on blocking him from my life, I just needed some reassurance from others not in my circle.",yellow,0.6988958627684041,0.9984226610977203,0.0,,0.0015773389022797346,0.0001046105899149552,0.00022238708334043622,0.00011737857130356133,0.00019946535758208483,0.00015912386879790574,0,0,0,0,0,0
Ditch him. He lacks empathy. Cheating destroys people. It is so bad. It is so wrong. His kink seems to be something related to upping these husbands. It's gross.,yellow,0.5646030217409134,0.806575745344162,0.0,,0.193424254655838,0.00028427093639038503,0.006259755697101355,0.00030816526850685477,0.006365184206515551,0.0007032877765595913,0,0,0,0,0,0
He’s scummy but less scummy than the taken women cheating on their men,red,0.046231281757354734,0.06604468822479248,0.0,,0.9339553117752075,0.016641955822706223,0.4811002314090729,0.001824172679334879,0.7351815104484558,0.07070229947566986,1,0,0,0,1,0
Still a crappy thing to do and tells me a lot about one's character. 🫤,yellow,0.558314023911953,0.7975914627313614,0.0,,0.2024085372686386,0.0006942922482267022,0.05152839794754982,0.00030604374478571117,0.008655643090605736,0.0004755888076033443,0,0,0,0,0,0
Yea the friend is not the type of dude I would align myself with for sure,yellow,0.6967243756633251,0.9953205366618931,0.0,,0.004679463338106871,9.537080040900037e-05,0.00038004230009391904,0.00010106862464454025,0.00033636688021942973,0.00016466851229779422,0,0,0,0,0,0
"Extremely shitty thing to do, me personally I could never contribute to breaking a home, just morals. I would not trust “Scotty” not a good dude imo.",red,0.14331778287887573,0.20473968982696533,0.0,,0.7952603101730347,0.006206845864653587,0.6526982188224792,0.0007627735030837357,0.17248235642910004,0.0025531931314617395,1,0,1,0,0,0
"You can’t control what your friend or those women do. He’s right to an extent: if they wanted to cheat, they’re gonna cheat. The only problem with it is that he’s the one actively trying to make sure they do or at least gave an option. 

You don’t need to convince him to stop, but you also don’t need to associate yourself with someone like that.",yellow,0.539694219827652,0.7709917426109314,0.0,,0.2290082573890686,0.00043423910392448306,0.01487757172435522,0.0006192452274262905,0.010863753035664558,0.0016286489553749561,0,0,0,0,0,0
He really made it your business when he discussed that with you.,yellow,0.6995363445428665,0.999337635061238,0.0,,0.000662364938762039,0.00011986688332399353,0.00017959062824957073,0.00012430451170075685,0.00018184898362960666,0.00014018305228091776,0,0,0,0,0,0
"I used to be this way in my early 20's. It's a shitty thing to do and I deserved to lose every single one of my friends. 

I wouldn't associate with someone like my old self any longer.",red,0.43397903740406035,0.619970053434372,0.0,,0.38002994656562805,0.0023898340296000242,0.29999980330467224,0.001225560437887907,0.028822844848036766,0.0014732020208612084,0,0,0,0,0,0
What convinced you to change?,yellow,0.6993364912690594,0.9990521303843707,0.0,,0.0009478696156293154,0.00010530196595937014,0.00016967442934401333,0.00011096381058450788,0.00019306842295918614,0.0001478043559473008,0,0,0,0,0,0
"He’s free to do it, and you’re free to keep him FAR away from your girlfriend, and other friend’s girlfriends.

This is a power thing… he will 100% do this to people he knows.

And I’m not saying the women aren’t responsible too, and shouldn’t take responsibility if they find someone they love more than their partner… but to lie and fake a relationship, and convince someone in a relationship of something not real, specifically to hurt others is pretty horrible.",yellow,0.6749711550772189,0.96424450725317,0.0,,0.03575549274682999,0.00017946292064152658,0.001977545442059636,0.00041955229244194925,0.0011294063879176974,0.00047518007340840995,0,0,0,0,0,0
I've made this point to the others. Some of them saw the light but with a couple of them it went through one ear and out the other.,yellow,0.699531626800308,0.9993308954290114,0.0,,0.0006691045709885657,0.00011838720820378512,0.00018395428196527064,0.00011539417027961463,0.00018370994075667113,0.00014060850662644953,0,0,0,0,0,0
"Yeah, I think you’re being wise. this isn’t just a “he fell for someone who is married.”

This is someone who gets off on coercing people to cheat. 

Highly doubt he wouldn’t find a way to justify it for a friend. “I was helping you bro! See she’s a cheater!”",red,0.14016191959381102,0.20023131370544434,0.0,,0.7997686862945557,0.0036649201065301895,0.26566001772880554,0.000492021965328604,0.46752363443374634,0.0045702531933784485,1,0,0,0,0,0
"Oh yeah. If he's single, unknowingly hooked up with someone who's married or in a relationship, that's an accident. If he goes after taken women on purpose, he's just a shitty person, and there's honestly no guarantee he wouldn't go after his friends' partners at some point.",red,0.28689366579055786,0.40984809398651123,0.0,,0.5901519060134888,0.0021984523627907038,0.2549988925457001,0.0004700201388914138,0.15812014043331146,0.0026734687853604555,1,0,0,0,0,0
"I had a “Scotty” as a friend about 20 years ago. He’s in a wheelchair now and the husband who put him there only did about five years. The funny thing is he’s still married to her, she cleaned up her act after she saw what happened to him.

I would tell him I’m not judging you, I’m just not going to be the one to take your ass to the hospital the day that one of these husbands finds you, because 9/10 he’s not even going to know it’s the husband until he’s already on the ground.

That’s exactly what happened to my former friend, started fucking married women for sport, eventually he got comfortable in one day someone caught him at their house.

The main thing is as a person you don’t want to be around that person when he does get caught .. what people don’t understand is if you don’t get caught in the act, that doesn’t mean you’re not going to get caught down the line.. that doesn’t mean one of these husbands isn’t going to find evidence of it later. So you’re always going to be watching your back. And trust me confidence and arrogance are only momentary feelings to make you feel like you’re in control. You’re not always in control and you’re not always going to be able to protect yourself.",yellow,0.5418553277850151,0.7740790396928787,0.0,,0.20441532135009766,0.003490820759907365,0.22592096030712128,0.0023594722151756287,0.05639437213540077,0.004847972188144922,0,0,0,0,0,0
"As 2Pac used to say, 
Some buck that I roughed up way back
Comin' back after all these years
Rat-a-tat-tat-tat-tat, that's the way it is",yellow,0.617618128657341,0.88231161236763,0.0,,0.11768838763237,0.000514014798682183,0.022527005523443222,0.00045604631304740906,0.01209126878529787,0.001691398094408214,0,0,0,0,0,0
"My ex's friend literally watched her dad shoot the boyfriend. 

She still cheated, repeatedly. The ex too, go figure.",yellow,0.6309237830340861,0.9013196900486946,0.0,,0.09868030995130539,0.00037898673326708376,0.01718573458492756,0.0003087487129960209,0.006477575283497572,0.0004899621708318591,0,0,0,0,0,0
People who do stuff in secret always get over confident and lazy and it always comes back to bite them in the ass the minute it’s going to hurt the most.,red,0.08080408573150634,0.11543440818786621,0.0,,0.8845655918121338,0.012237285263836384,0.775323212146759,0.0020622361917048693,0.19475093483924866,0.0038729398511350155,1,0,1,0,0,0
"Wonderful insight , thank you. ",yellow,0.6996235868020448,0.9994622668600641,0.0,,0.0005377331399358809,0.0001458749466110021,0.0002194899570895359,0.00014077458763495088,0.00018474280659575015,0.00014721922343596816,0,0,0,0,0,0
"If his ethics, behavior and morals are different from yours in every way then what is the basis and nature of this friendship? You do have to judge him because he's sitting right there in your living room.",yellow,0.6984706045594066,0.9978151493705809,0.0,,0.0021848506294190884,8.730163244763389e-05,0.00019209375022910535,0.000111306959297508,0.00022945398814044893,0.00016424337809439749,0,0,0,0,0,0
Just remember he would probably do it to you if you were married.,yellow,0.699238547810819,0.9989122111583129,0.0,,0.0010877888416871428,0.00011382611410226673,0.00016888900427147746,0.0001680251443758607,0.00019029498798772693,0.0001603252167114988,0,0,0,0,0,0
"Yes! I had a ""friend"" like this and a wife like this as well. They hated each other until he got a job at her place of employment and suddenly they're gettin' along great. Just typing that out made me feel like my soul was crushed. Quite a few of my ""buddies"" deleted me and kept her as Facebook friends. They all deserve each other. I never dreamed that sex could seem like something demonic and utterly vile but my ex proved me wrong.",yellow,0.6229306720197201,0.8899009600281715,0.0,,0.11009903997182846,0.0004196294758003205,0.015009051188826561,0.00038060900988057256,0.0027639027684926987,0.0006354094948619604,0,0,0,0,0,0
Show me your friends and I will show you your future. You are better off without those without the same morals.,yellow,0.6735594905912876,0.9622278437018394,0.0,,0.03777215629816055,0.00022173539036884904,0.0005547748878598213,0.001670957077294588,0.0014692399417981505,0.0007056610193103552,0,0,0,0,0,0
You’re an adult with the ability to make decisions on your own. He’s shitty and a bad person. Can’t imagine why you’d want to be friends with someone like that.,red,0.08900554180145263,0.1271507740020752,0.0,,0.8728492259979248,0.00990969780832529,0.5987966656684875,0.0008686581859365106,0.6541902422904968,0.010580108501017094,1,0,1,0,1,0
That’s sociopathic. Drop him like a lead balloon.,yellow,0.5312278941273689,0.758896991610527,0.0,,0.24110300838947296,0.00027243810473009944,0.005031738430261612,0.0004777046851813793,0.014380126260221004,0.0014091702178120613,0,0,0,0,0,0
"Two things are true. They're ruining their marriages by cheating, and he's not a good person for sleeping with taken people, since he knows they're in relationships/marriages and finds it ''fun''. Not cool of him to start cussing you out and tell all your mutual friends. You don't have to be friends with him if you don't want to/don't agree with him doing this",yellow,0.6670282110571861,0.9528974443674088,0.0,,0.04710255563259125,0.00021563337941188365,0.00370164611376822,0.0002952947688754648,0.002203067997470498,0.0004970386507920921,0,0,0,0,0,0
"Unfortunately that's the excuse many people use (I especially read this about men) ""I owe no obligation or loyalty to him, so I can do this."" It's dangerous, selfish and evil. I commend you for making a statement.",yellow,0.6952814627438784,0.9932592324912548,0.0,Includes quotes/citations.,0.0067407675087451935,0.00010284317977493629,0.0003393609949853271,0.00017042140825651586,0.00036316760815680027,0.0002442712429910898,0,0,0,0,0,0
Thank you. This whole situation really made me angry since I have a close friend whose gf cheated on him and it left deep mental and emotional scars. I can't imagine putting someone else through that.,yellow,0.6990909637068398,0.9987013767240569,0.0,,0.0012986232759431005,9.95123918983154e-05,0.00019686097220983356,0.00011398241622373462,0.00019612970936577767,0.00015229186101350933,0,0,0,0,0,0
"You get it. 

Just because this friend of yours doesn't owe these other spouses anything, not caring about the emotional trauma that cheating inflicts is just cruel. Cruel to humanity in general.

 Everyone should have a goal in life to not harm other people. Seducing committed women is creating harm. Maybe they would have cheated anyway. But they wouldn't have? Point is that your friend is trying to get them do something that will cause great harm to another human. Fuck him. He's a loser.",red,0.005876553058624267,0.008395075798034668,0.0,1 profane term(s).,0.9916049242019653,0.06812398135662079,0.9372011423110962,0.0024947049096226692,0.8475857377052307,0.012729310430586338,1,0,1,0,1,0
Thanks.,yellow,0.6995749026944394,0.9993927181349136,0.0,,0.0006072818650864065,0.0001253167138202116,0.0001928310957737267,0.00011650355736492202,0.00017581212159711868,0.00013912982831243426,0,0,0,0,0,0
Fuck scotty he's a pos,red,0.0024036347866058347,0.0034337639808654785,0.0,,0.9965662360191345,0.2776278257369995,0.9874162077903748,0.0018553310073912144,0.9151368141174316,0.013133873231709003,1,0,1,0,1,0
"Get better friends, but also, it takes two to tango.",yellow,0.6995831332169473,0.9994044760242105,0.0,,0.000595523975789547,0.00012789960601367056,0.0001817082375055179,0.00012882309965789318,0.00017986894818022847,0.00014366218238137662,0,0,0,0,0,0
"I can tell you one thing about Scotty, if you get a girlfriend, he'll try to fuck her. I had a Scotty once, till he slept with a friend's wife, and when he got caught, he doubled down and slept with the same guys mom. I'll never understand it. The dude was apparently a witch because it wasn't looks / personality / money. He was just a ginger kid with a completely average dick, which he loved to show off. I guess confidence must REALLY count, lol.",red,0.019361257553100586,0.027658939361572266,0.0,,0.9723410606384277,0.06845360994338989,0.9215080738067627,0.019793465733528137,0.6373651027679443,0.02954876609146595,1,0,1,0,1,0
"++man 
Oh my god, what did the other guy do?! If a guy banged my girl AND my mum I would fucking snap.",red,0.004122716188430786,0.005889594554901123,0.0,,0.9941104054450989,0.2270495742559433,0.9689891934394836,0.07138419896364212,0.3392089307308197,0.0077907619997859,1,0,1,0,0,0
"Your cousin is partially right, the women are the ones ruining their relationships, but anyone that knowingly pursues married women & “seduces” them is a POS.. if you have a girlfriend or a wife, the chances are he will pursuit them at some point.. the guy has no boundaries.",yellow,0.6557150714099407,0.9367358162999153,0.0,,0.06326418370008469,0.00018766961875371635,0.002328768139705062,0.00025307192117907107,0.003081661183387041,0.000925705477129668,0,0,0,0,0,0
"You are never going to change his behavior. If you can’t accept his behavior, they you need to  move on from your friendship.",yellow,0.6983364026993513,0.9976234324276447,0.0,,0.0023765675723552704,9.854748350335285e-05,0.00021310809825081378,0.00014234062109608203,0.00022593104222323745,0.00017857701459433883,0,0,0,0,0,0
I would not be friends with a shitty person like this.,red,0.0757582426071167,0.10822606086730957,0.0,,0.8917739391326904,0.01023681741207838,0.7549221515655518,0.0009072599932551384,0.15655849874019623,0.001720233354717493,1,0,1,0,0,0
Your friend will fuck yours.,red,0.0016296684741973877,0.0023280978202819824,0.0,,0.997671902179718,0.2647012174129486,0.9857156872749329,0.008090955205261707,0.8355510234832764,0.0071173463948071,1,0,1,0,1,0
Don’t leave your girl alone with him.,red,0.42372154295444486,0.6053164899349213,0.0,,0.39468351006507874,0.0004370416281744838,0.006346735637634993,0.002101752208545804,0.01016791071742773,0.0015744669362902641,0,0,0,0,0,0
"Good friend keep their friends in check.

You were being a good friend to Scotty. If his response was to avoid accountability and get angry for being called out, he doesn’t deserve your friendship.",yellow,0.695839824154973,0.9940568916499615,0.0,,0.0059431083500385284,0.00010054549784399569,0.00033917033579200506,0.0001793821866158396,0.00034852034877985716,0.0002178296126658097,0,0,0,0,0,0
"The bulk of the blame is definitely on the shoulders of the women. They are the ones who cheated. But just because he hasn’t taken any vows doesn’t mean he isn’t as terrible as they are. We are all capable of making bad decisions. Sometimes we wouldn’t make those decisions  without getting carried away or making impulsive decisions. I’m not saying that to justify cheating, but I am saying it to condemn your friend for exploiting a moment of weakness in these women who probably would not have cheated had the opportunity and enticement never occurred. Eventually a husband is going to catch him in the act and there are a lot of men who would kill your friend and their cheating spouse in the heat of the moment.",yellow,0.6822566397488117,0.9746523424983025,0.0,,0.02534765750169754,0.00013258449325803667,0.0008996482356451452,0.0002800269576255232,0.0011571759823709726,0.0005392400198616087,0,0,0,0,0,0
"He is a loser. He gets off on the excitement of ruining other people’s relationships. If it happened one time with someone he was really interested in maybe it could be rationalized. Him intentionally choosing woman because they’re in committed relationships is pathetic. 

You choosing to remain friends with a person like that also says a lot about you and your morals.",red,0.1421989321708679,0.20314133167266846,0.0,1 profane term(s).,0.7968586683273315,0.0014458774821832776,0.045502595603466034,0.0005483025452122092,0.4125974178314209,0.005945190787315369,1,0,0,0,0,0
 The fact that he KNOWINGLY engages with taken women shows that he has ZERO integrity. To say he lacks moral character is a gross understatement.,yellow,0.5927429661154746,0.8467756658792496,0.0,,0.15322433412075043,0.0002903501153923571,0.004561293870210648,0.00034185187541879714,0.007637915201485157,0.0017910924507305026,0,0,0,0,0,0
"I mean, more than anything, if you're planning on getting married to a woman at all I wouldn't be friends with this guy.",yellow,0.6952214011456817,0.9931734302081168,0.0,,0.00682656979188323,9.674734610598534e-05,0.00034328558831475675,0.00016254767251666635,0.0003897426067851484,0.0002393046161159873,0,0,0,0,0,0
"Youre friend is a trash person. Hes encouraging them to cheat. The women are trash too. Anyone absolving him of any guilt is trash as well. 

Here's a silver lining. Hes ruined himself. He'll never be able to settle down. He'll never trust a committed relationship.",red,0.07389997243881224,0.10557138919830322,0.0,3 profane term(s).,0.8944286108016968,0.004754701163619757,0.2873934507369995,0.0006811593775637448,0.5441091656684875,0.008683625608682632,1,0,0,0,1,0
The women would not sleep with him if they did not want to.,yellow,0.5882730290293693,0.8403900414705276,0.0,,0.15960995852947235,0.0005384478135965765,0.004829110112041235,0.0008613092359155416,0.002559749176725745,0.002907533897086978,0,0,0,0,0,0
"True, but he still could've rejected them or stered clear instead of actively pursuing them.",yellow,0.699555042060092,0.9993643458001316,0.0,,0.0006356541998684406,0.00012285509728826582,0.00018078763969242573,0.0001265295868506655,0.00018013290537055582,0.00014542858116328716,0,0,0,0,0,0
"Oh I guess your question is mainly whether or not to cut him out of your life.

Yeah, I'd never talk to him, he is a garbage human being.

I don't blame him for the women cheating, or even with happening to sleep with married women. But purposefully going after married women for the hunt is just....",red,0.13912522196769714,0.1987503170967102,0.0,Repeated punctuation.,0.8012496829032898,0.004534471780061722,0.12676912546157837,0.009764308109879494,0.25169065594673157,0.030787605792284012,1,0,0,0,0,0
"He's just as bad for sure.

If you got into an argument with your neighbor over a parking spot and in a fit of anger decided to slash his car tires, but came to me to borrow a knife, I'm not any better if I know you're going to stick it in his tires instead of chopping vegetables. It wouldn't matter if you'd have found another knife without me.

It's the same logic. 

But, you get a lot of dudes on reddit in their early 20s who have the emotional and intellectual maturity of 16 year olds, so they'll downvote just for repeating something that has been an accepted moral standard for all of humanity from the beginning of time. It's not remotely a hot take and there is no place where the affair partner is viewed as not having also done something wrong, at least presuming they were in the know, like your friend.",yellow,0.6437912702560424,0.9197018146514893,0.0,,0.08029818534851074,0.000192470513866283,0.0022664701100438833,0.0005631458479911089,0.005227472633123398,0.0009698171634227037,0,0,0,0,0,0
"While that's true, it takes two to tango and he's not any better just because he hasn't taken a vow. That's a just a cop out from someone who doesn't want to take personal responsibility for doing a shitty, selfish thing.

I helped a bad person do something bad but because they were going to do it anyway I'm innocent, is nonsense logic. People jump through lots of hoops just to tell themselves and others that they haven't done anything wrong, when they've done something blatantly wrong.",yellow,0.6849447984248399,0.9784925691783428,0.0,,0.02150743082165718,0.00021811308397445828,0.003932367544621229,0.00020993073121644557,0.0012577424058690667,0.0002603847242426127,0,0,0,0,0,0
"Honestly, I don't even try to hit on married/taken women but I always end up sleeping with one. Either they: 

* Pretend they are single when they are literally just on a break
* Not getting with her husband and say she's ""separated""
* You really try not to sleep with them but they really want to just want to sleep with you and they tend to aggressively pursue men they want especially if they are married. 

If you think these women are  little angels being forced to cheat you must have very little experience with women.

Maybe 20 years ago sure, but nowadays women are just men with boobs. The women nowadays are actually way more vulgar and disgusting than men nowadays because they are always held to such low standard by desperate men.",red,0.22670574784278869,0.3238653540611267,0.0,,0.6761346459388733,0.005496320780366659,0.2740783989429474,0.002026292495429516,0.1626252830028534,0.038936812430620193,1,0,0,0,0,0
Where is this nympho milf island?,yellow,0.5972871080040931,0.8532672971487045,0.0,,0.14673270285129547,0.0002605312329251319,0.003381926566362381,0.00033470013295300305,0.011016646400094032,0.0015479355351999402,0,0,0,0,0,0
"Eventually someone will knock his teeth out, ask him how he feels about it then.",red,0.38682089447975154,0.5526012778282166,0.0,,0.44739872217178345,0.005853377748280764,0.008608553558588028,0.2808073163032532,0.011293748393654823,0.00908589642494917,0,0,0,0,0,0
