text,badge_color,final_score,model_cred,heur_score,heur_tips,prob_toxic,prob_severe_toxic,prob_obscene,prob_threat,prob_insult,prob_identity_hate,pred_toxic,pred_severe_toxic,pred_obscene,pred_threat,pred_insult,pred_identity_hate
"He has issues with relationships and commitment so it’s easier for him to sleep with committed women so he doesn’t have to deal with all that. He is a troubled person. Probably deeply lonely, and in deep need of validation (hence being able to give these women something their husbands can’t). He deserves compassion, but I would have a hard time being friends with someone who has no ability to self reflect and admit to participating in some part to damaging a marriage. Yes, the married women are to blame, but he is too!  I don’t blame you for wanting to distance yourself from this person.",yellow,0.6904093272052705,0.9862990388646722,0.0,,0.013700961135327816,0.00011392580199753866,0.0006800246774218976,0.0001647402677917853,0.0006345676956698298,0.0003138449683319777,0,0,0,0,0,0
"My friends are divided, some say its written by ChatGPT, some just gobbles up the AI slop.",yellow,0.6983608073787764,0.9976582962553948,0.0,,0.0023417037446051836,9.247146954294294e-05,0.000291734206257388,8.892501500668004e-05,0.0002405077830189839,0.00014457423822022974,0,0,0,0,0,0
You are known by the company you keep...I would prefer to not keep much company ++ woman,yellow,0.68449687063694,0.9778526723384857,0.0,Repeated punctuation.,0.022147327661514282,0.00010824849596247077,0.0008550927741453052,0.00021852314239367843,0.0007776190177537501,0.000309439143165946,0,0,0,0,0,0
"Very clear projection on his behalf to participate in and slander the thing he hates most about himself. 


It takes two. 
Each party is responsible.


No excuse. 
But, is what it is. He can make up whatever reason to avoid accountability, until he doesn't anymore. And well, he might not ever get there, lol. ",yellow,0.6848867835476994,0.9784096907824278,0.0,,0.021590309217572212,0.00011366126273060217,0.0007003783248364925,0.0002339747006772086,0.0007975655607879162,0.00037397598498500884,0,0,0,0,0,0
"I mean, it is mainly the cheater's fault for cheating. But it's still a shitty thing to knowingly take part in an affair. It sounds like he's shirking all responsibility though. When you have a GF is there a reason why you should expect him not to try to get her to cheat on you with him? If he doesn't think it's wrong to do it to other men, he wouldn't think it's wrong to do it to you. If you had a GF would you be able to defend calling someone like him your friend?",yellow,0.5443050667643546,0.777578666806221,0.0,,0.222421333193779,0.0013376576825976372,0.17253492772579193,0.0006418487173505127,0.027264965698122978,0.0013620282988995314,0,0,0,0,0,0
"If you find his behavior gross, which it is, and he doesn't, it sounds like the friendship is over. You are the company you keep, and if you keep someone around that actively enjoys sleeping with married women as a hobby, then you may get judged for it too. The kicker is that he thinks cheating is awful but has no qualms in getting his dick wet with cheaters. Complete and total hypocrite. Yes, the women sleeping with him are problematic, but the fact that he thinks he gets a pass while the cheating partner does not, despite that he is actively pursuing them and encouraging infidelity, makes him a slimeball as well. Doing morally objectionable things is not a ""lifestyle choice."" The guy is just a dickhead and trying to justify his shitty behavior. You called him on it, and he didn't like it. Don't hang out with him anymore if you behind his behavior a deal breaker for your moral compass.",red,0.2459344923496246,0.35133498907089233,0.0,,0.6486650109291077,0.005584843456745148,0.4716835021972656,0.0018679756904020905,0.16908232867717743,0.009167630225419998,1,0,0,0,0,0
Your values are reflected in the friends you have in your life.,yellow,0.6995162022765725,0.9993088603951037,0.0,,0.000691139604896307,0.0001250450441148132,0.0001615726068848744,0.0001449288392905146,0.00019073241855949163,0.00015687163977418095,0,0,0,0,0,0
"Your friend is a f\*cking idiot. Whatever his age is, he has some real issues. It's nice to hear that you have morals and know what is wrong. Ditch him as a friend; he'll bring nothing but bad energy around you - you deserve better than that.",red,0.004719400405883789,0.006742000579833984,0.0,1 profane term(s).,0.993257999420166,0.09973250329494476,0.9492477774620056,0.0015303618274629116,0.9339109063148499,0.01256276573985815,1,0,1,0,1,0
"So...

Your friend is not making those women cheat.  He's right about that. And they probably would cheat anyway. 

But that doesn't mean he has to help them.  I compare this to charges of ""aiding and abetting"" a crime. He didn't commit the crime, but he certainly was part of it. 

Your friend has questionable moral integrity. No one is perfect, but this is a pretty deep one. He will not think twice about screwing you over. Whether you keep the friendship is up to you, but don't expect much from him as a friend. He's probably entertaining and fun, but I'd bet he doesn't ever show up when there's work to be done, or difficult times.",yellow,0.659646189212799,0.9423516988754272,0.0,Repeated punctuation.,0.057648301124572754,0.0002206949284300208,0.0039727771654725075,0.00037408151547424495,0.0028744693845510483,0.0007444900111295283,0,0,0,0,0,0
I commend you for standing up for your morals. And holding other men accountable.,yellow,0.6865019688382744,0.9807170983403921,0.0,,0.019282901659607887,0.00012069152580806985,0.0004589251766446978,0.00028762250440195203,0.0007855989970266819,0.0004502265073824674,0,0,0,0,0,0
Thats fucked jeez,red,0.0058595299720764155,0.008370757102966309,0.0,,0.9916292428970337,0.18343636393547058,0.9806222915649414,0.004936572629958391,0.26473817229270935,0.0036084295716136694,1,0,1,0,0,0
Perhaps don’t hang out with your friend and limit the time you spend with your cousins. From what you said they share a similar disturbing attitude about women and it is morally depraved and misogynistic.,yellow,0.5490292340517043,0.7843274772167206,0.0,,0.21567252278327942,0.0003782031999435276,0.0024356700014322996,0.0007629850879311562,0.006911996752023697,0.0055374568328261375,0,0,0,0,0,0
"The shitty thing is that he specifically likes to target taken women and make them cheat. This is even a step above just not caring if they are taken and even that would be a shitty thing to do. When you know they are taken you should not try to actively seduce them. If you are passive and she actively tries to seduce you I would probably care less though.

I have slept with a taken woman before and I am not proud of it... There is nothing to gain for either side. Even if they break up after this she gets together with you, you have a cheating partner. But you could even argue that you save the guys. Weird thought but here and there you see videos where women ask other girls to test if their boyfriends would cheat.

His intent is disgusting. But the overall argument is still also true, that the girls have their own mind and should have said no and not engaged in a setting where they flirt with another guy. So they are mainly responsible for it.",red,0.0870026171207428,0.12428945302963257,0.0,Repeated punctuation.,0.8757105469703674,0.012032520957291126,0.741274893283844,0.002429784508422017,0.3233503997325897,0.009514402598142624,1,0,1,0,0,0
Primates being primates.,yellow,0.6945946970488875,0.992278138641268,0.0,,0.007721861358731985,0.00011360990174580365,0.00036717785405926406,0.00013677903916686773,0.0004621716507244855,0.0003339342656545341,0,0,0,0,0,0
"Your friend isn’t married and isn’t a cheater, but his moral character should be questioned. 

Does he have a line? What if you had a gf, would he make a move on her? If he thought she was going to cheat anyways? 

My stopped being friends with a guy because he confessed to cheating on his wife. I told him what I thought and never spoke to him again.",yellow,0.6446837045252323,0.9209767207503319,0.0,,0.07902327924966812,0.00023533521743956953,0.00566499587148428,0.00026807436370290816,0.005232779309153557,0.000620744947809726,0,0,0,0,0,0
"You should:
1) Choose better friends.
2) Probably mind your own business.",yellow,0.6406250804662704,0.9151786863803864,0.0,,0.08482131361961365,0.00018059363355860114,0.0007725426694378257,0.00117376574780792,0.003261924022808671,0.0008356295875273645,0,0,0,0,0,0
Nothing. It’s his life. You can choose to be part of it or not.,yellow,0.6949113074224442,0.9927304391749203,0.0,,0.0072695608250796795,9.91345732472837e-05,0.00042814272455871105,0.00014751346316188574,0.0003713390324264765,0.00020527525339275599,0,0,0,0,0,0
"One day he'll get caught with the wrong one and her man will make your friend holey.   The whole play stupid games, win stupid prizes. Lol",red,0.07921384572982787,0.11316263675689697,0.0,2 profane term(s).,0.886837363243103,0.0024018166586756706,0.06401797384023666,0.005870072171092033,0.2254384458065033,0.00505920359864831,1,0,0,0,0,0
"There is a theory that if no one bought stolen goods, no one would steal because they couldn't find a buyer. Hence, stealing is a waste of time.

The same logic applies to infidelity. If Scotty stops having sex with married women those women would stop cheating. Absolutely untrue! They will find someone to have sex with. He isn't the cause of their infidelity. If he considers this a recreational activity that's up to him. You don't have to condone it but it's not up to you and it's none of your business.

Scotty is his own problem and you are yours. As the current saying goes - You do you.",yellow,0.5959790006279945,0.8513985723257065,0.0,,0.14860142767429352,0.0003732634359039366,0.0061858538538217545,0.0007402728078886867,0.004878622945398092,0.0030645718798041344,0,0,0,0,0,0
"He goes out of his way to *seduce them* . They aren’t the ones who went to him. 
They are still in the wrong but going out of your way to seduce married people is an extra level of evil.  ",yellow,0.5542940929532051,0.7918487042188644,0.0,,0.20815129578113556,0.0003707308496814221,0.0036142151802778244,0.001066315919160843,0.005714581813663244,0.0023180267307907343,0,0,0,0,0,0
"Under no circumstances do you have to associate with this man. I say that despite being the type to not care what my friends do behind closed doors, ie I wouldn’t care if someone told me that despite being against his actions myself. If associating with him goes against your identity, then it’s your prerogative to cut him out of your life. Weigh what your friends say, but don’t let them dictate how to live your life",yellow,0.6435570672154426,0.9193672388792038,0.0,,0.0806327611207962,0.00024384168500546366,0.0013432168634608388,0.002200547605752945,0.0021433308720588684,0.000870455289259553,0,0,0,0,0,0
Why do you even care? Is his sex life effecting yours in any way? Mind your own business and keep living your own life.,red,0.10862998962402343,0.15518569946289062,0.0,,0.8448143005371094,0.0017671030946075916,0.081781767308712,0.0017992097418755293,0.07333443313837051,0.0028068183455616236,1,0,0,0,0,0
"So many people in the comments acting like he’s not as bad as the women. The women are absolutely garbage… BUT, so is the man. A man sleeping with a married woman is trying to break up a marriage. If the married couple has kids, he’s trying to break up the family. It’s the absolute vilest of behavior. 

Once you get below a certain level of shitty behavior it’s all just shitty. Like temperature. Once you get below negative twenty Fahrenheit it’s all just cold. Yeah, negative forty is colder, but not really in any meaningful way. So yeah, there is an argument that the women are worse, but not necessarily in any meaningful way… AND, the women are just trying to break up the one marriage that they are in. This piece of garbage is trying to break up as many as possible.",red,0.3366269052028656,0.4808955788612366,0.0,,0.5191044211387634,0.0032168892212212086,0.2506977617740631,0.0010722439037635922,0.0795646384358406,0.0095204534009099,1,0,0,0,0,0
True! It’s like the man is on a mission to destroy any sense of romantic trust in the world. Probably compensating,yellow,0.6959125135559588,0.9941607336513698,0.0,,0.00583926634863019,9.62330013862811e-05,0.00034311937633901834,0.00012548388622235507,0.0003170502313878387,0.00019545484974514693,0,0,0,0,0,0
Totally agree. These guys pick up on the vulnerability from an unhappy marriage and exploit it for their own benefit.,yellow,0.6995768633612897,0.9993955190875567,0.0,,0.0006044809124432504,0.00012574500578921288,0.00018019165145233274,0.00013194431085139513,0.00018253187590744346,0.00014505063882097602,0,0,0,0,0,0
Mind your own business.  If you don't like it the don't hang out with him.,yellow,0.4698496431112289,0.6712137758731842,0.0,,0.3287862241268158,0.00038081133970990777,0.00437129708006978,0.002231755293905735,0.00731689902022481,0.0010360447922721505,0,0,0,0,0,0
"It takes 2 to tango: Scotty has to want to sleep with the married women, and the married women have to want to sleep with Scotty. If these woman already want to cheat, then if it’s not Scotty then it’s someone else.
I’m not saying this to condone cheating, but there must be supply and demand. I’d have said nothing, and if you have a significant other then start distancing yourself from him. Otherwise there’s not much you can do.",yellow,0.6345279574394226,0.9064685106277466,0.0,,0.09353148937225342,0.00032328080851584673,0.0053049661219120026,0.000620167818851769,0.004410840105265379,0.0017773860599845648,0,0,0,0,0,0
"When you get older, getting involved in other people’s lives because it challenges your own beliefs becomes less appealing because of the exact experiences you are now going through.

In the future just remember you always have the option to distance yourself from them without having to “correct” them. 

GL, I’d just cut your losses. His behaviour will catch up with him and when it all implodes you don’t really want to be around him anyways for that.",yellow,0.6959172856528312,0.994167550932616,0.0,,0.005832449067384005,9.356058581033722e-05,0.00023887287534307688,0.00018741014355327934,0.0004344913177192211,0.00024590580142103136,0,0,0,0,0,0
"Your value hits up against his. He'll either change or he won't based off his own learnings, you need to either let it go or let him go...",yellow,0.6976160038262605,0.9965942911803722,0.0,Repeated punctuation.,0.003405708819627762,9.638720075599849e-05,0.00026476389029994607,0.0001627711608307436,0.00026155763771384954,0.00018572728731669486,0,0,0,0,0,0
"This is the part where you get to decide if you lower your standards. 

Don't let some other person tell you what is acceptable and what is not.

You're the boss",yellow,0.6239651791751384,0.891378827393055,0.0,,0.10862117260694504,0.0001542180252727121,0.002532522426918149,0.0003357423411216587,0.005543654318898916,0.0004547129792626947,0,0,0,0,0,0
"Be careful being around this Scotty person in public or having him over to your place. One day one of the men are going to come after him. It's not it, but when. 
When a man is raging there is no telling what he may do to others around while trying to get to Scotty or firing off and hitting you on accident.",yellow,0.6826112182810902,0.9751588832587004,0.0,,0.02484111674129963,0.00017771311104297638,0.0008306317613460124,0.0009861431317403913,0.0011345575330778956,0.0004637749516405165,0,0,0,0,0,0
Ask my ex wife.,yellow,0.6760652143508196,0.9658074490725994,0.0,,0.03419255092740059,0.00014162740262690932,0.002152139786630869,0.00024475730606354773,0.0009588159737177193,0.00026364094810560346,0,0,0,0,0,0
Maybe those women are in open relationships. We don’t know the facts - you don’t and neither does he. What consenting adults do is none of (y)our business. ++man,yellow,0.6571807101368904,0.9388295859098434,0.0,,0.061170414090156555,0.00015681196236982942,0.0021088789217174053,0.00022748670016881078,0.001972200581803918,0.000696278759278357,0,0,0,0,0,0
"A friend of mine was shot multiple times at once for that. He was actually unaware that his girlfriend was married, until he answered his door and got shot. He actually survived. But yeah, that's incredibly dangerous.",yellow,0.6894255770370363,0.9848936814814806,0.0,,0.015106318518519402,0.0002912633935920894,0.0013693379005417228,0.0010832702973857522,0.0008873761398717761,0.0007521638763137162,0,0,0,0,0,0
"Its not really his fault these committed women are sleeping with him- its on them, they are willing participants. 

BUT, I bet you anything this guy is also gonna cheat in a committed relationship.  Perhaps he hasn't really been there yet. But im guessing he will, and when he does, he will find some other justification for it.",yellow,0.5918256387114524,0.8454651981592178,0.0,,0.15453480184078217,0.0005886693834327161,0.023532424122095108,0.0006091412506066263,0.0068362560123205185,0.0016179434023797512,0,0,0,0,0,0
Let him learn and find out the hard way.,yellow,0.6992504338850267,0.9989291912643239,0.0,,0.0010708087356761098,0.00010693068179534748,0.0001640080299694091,0.00013159174704924226,0.00018930993974208832,0.00015280752268154174,0,0,0,0,0,0
it's true that the wives are to blame but I wouldn't want to be friends with a person that doesn't respect other people's commitments either,yellow,0.6981668187072501,0.9973811695817858,0.0,,0.002618830418214202,9.077962749870494e-05,0.0002326759567949921,0.0001090170189854689,0.00023083947598934174,0.0001826429506763816,0,0,0,0,0,0
"If you want to be petty, remember all of this and when some day he gets a girlfriend, someone he cherishes and wants to settle down with seduce her or facilitate a situation for her to cheat.

Call it karma. He had earned it.",yellow,0.6629745755344629,0.9471065364778042,0.0,,0.052893463522195816,0.0002032462798524648,0.0036388260778039694,0.00028898310847580433,0.002931385999545455,0.0004176631919108331,0,0,0,0,0,0
Find a new friend.   Tomorrow,yellow,0.6985505619551986,0.9979293742217124,0.0,,0.002070625778287649,9.739613597048447e-05,0.00017947902961168438,0.00013136582856532186,0.00021178174938540906,0.0001750069495756179,0,0,0,0,0,0
I had a history of doing this myself. I now know I was being awful. Just because I’m not doing the cheating doesn’t mean I didn’t have a direct hand in other people’s suffering when I should have known better. Did plenty of psychological tricks to convince me I had done nothing wrong.,yellow,0.6964050702285021,0.9948643860407174,0.0,,0.005135613959282637,0.00010097152699017897,0.00040709259337745607,0.00013349115033634007,0.00031310052145272493,0.00017695777933113277,0,0,0,0,0,0
"It sounds like your friend and his playmates are all s****y people.

There is nothing judgmental about that, it's just a fact.",yellow,0.48818611502647397,0.6974087357521057,0.0,,0.3025912642478943,0.0011722863418981433,0.10475263744592667,0.0006063082837499678,0.04424066096544266,0.002227039309218526,0,0,0,0,0,0
yes he is a really crappy person but also he isnt cheating the women are...if you dont like what he is doing you dont have to be friends anymore...but just remember karma will come around and when he grows up and settles down I bet he gets cheated on...and he will know how it feels...and he had better make sure that one of their husbands dont come looking for him or is a cop or something,red,0.35743197500705715,0.5106171071529388,0.0,Repeated punctuation.,0.48938289284706116,0.0014039688976481557,0.10765912383794785,0.0008350798743776977,0.0755530446767807,0.004013927187770605,0,0,0,0,0,0
None of my business. He didn't commit to these relationships and it's two consenting adults.,yellow,0.697933753603138,0.9970482194330543,0.0,,0.002951780566945672,9.695089102024212e-05,0.0003080013848375529,9.634622256271541e-05,0.00023969190078787506,0.00016273563960567117,0,0,0,0,0,0
"Your friend is shitty, the only wives that are acceptable to sleep with are Military/Law Enforcement wives or wives of abusive/cheating partners.",red,0.01926491856575012,0.02752131223678589,0.0,,0.9724786877632141,0.02608439326286316,0.854584276676178,0.0007944332319311798,0.7100001573562622,0.006810772232711315,1,0,1,0,1,0
Just because someone is going to cheat.  One doesn't have to be the person they do it with.  One can still control their side of all those equations.,yellow,0.6965034728869796,0.9950049612671137,0.0,,0.004995038732886314,9.221574873663485e-05,0.00032931435271166265,0.00013726299221161753,0.000318042904837057,0.00016545687685720623,0,0,0,0,0,0
Its gross that the women cheat. And its gross that he loves such gross behaviour let alone endorses it,yellow,0.4782708764076233,0.6832441091537476,0.0,,0.31675589084625244,0.0004910595598630607,0.008122476749122143,0.0006104616913944483,0.0076111298985779285,0.003023015335202217,0,0,0,0,0,0
"As an ENM poly guy, I COULD sleep with anyone.... But I choose not to associate with dishonest people because then I become one. It rubs off. ""Tell me who you run with, and I'll tell you who you are.""",yellow,0.6680359344929456,0.9543370492756367,0.0,Includes quotes/citations.; Repeated punctuation.,0.04566295072436333,0.0001559193042339757,0.0019370006630197167,0.00036461054696701467,0.0015144676435738802,0.00037115480517968535,0,0,0,0,0,0
It’s ok to not be friends with someone because of the things they do.,yellow,0.699547842395259,0.9993540605646558,0.0,,0.0006459394353441894,0.0001223143481183797,0.00017275760183110833,0.00013162186951376498,0.00017679131997283548,0.00014562354772351682,0,0,0,0,0,0
"Sometimes doing the right thing hurts and loses us more than we thought we would lose, but it is important to do the right thing anyway.",yellow,0.699317664996488,0.9990252357092686,0.0,,0.0009747642907314003,0.00010864290379686281,0.0001694792736088857,0.00012650220014620572,0.0001781430037226528,0.00015465302567463368,0,0,0,0,0,0
"It's a pretty shitty thing he does. Ok, only you can answer if it is something to cut him out of your life. You don't need a reason though. His values just no longer align with yours. Personally, I agree with you.",yellow,0.5203170239925384,0.7433100342750549,0.0,,0.25668996572494507,0.0015228608390316367,0.19565512239933014,0.0011921966215595603,0.01892620325088501,0.0013658817624673247,0,0,0,0,0,0
Your friend is a sociopath.,red,0.04310295581817627,0.06157565116882324,0.0,,0.9384243488311768,0.005752946250140667,0.18460635840892792,0.0007936481852084398,0.7630199193954468,0.014312798157334328,1,0,0,0,1,0
Wait till he cheats with one of their significant others!!!!,red,0.34142900109291074,0.4877557158470154,0.0,Repeated punctuation.,0.5122442841529846,0.0007356895366683602,0.009507196955382824,0.0029976931400597095,0.013637375086545944,0.0018110020318999887,1,0,0,0,0,0
I think is psyche is wild. Could still hate cheaters and be doing it out of hate. Don’t invest in this ‘friend’.  ++woman,red,0.10343390107154846,0.1477627158164978,0.0,,0.8522372841835022,0.007620485499501228,0.27755382657051086,0.002338228514418006,0.3351283371448517,0.07890868186950684,1,0,0,0,0,0
You need better friends.,yellow,0.6995556389796547,0.9993651985423639,0.0,,0.0006348014576360583,0.00012883194722235203,0.00017012674652505666,0.00014217838179320097,0.0001915054308483377,0.00015203200746327639,0,0,0,0,0,0
"He's not a good friend. Dime his ass out and excommunicate him. He'll fuck your woman, too, if given the chance. Burn him.",red,0.0027849018573760983,0.003978431224822998,0.0,,0.996021568775177,0.44251134991645813,0.9607821106910706,0.6308758854866028,0.829857349395752,0.050783272832632065,1,0,1,1,1,0
"++man Is he a good enough friend that you'd leave your girl with him(if you had one)?  If the answer is no because you don't trust him after hearing that, then what good is a friend you can't trust?",yellow,0.691356885060668,0.9876526929438114,0.0,,0.012347307056188583,9.733485785545781e-05,0.0004942820523865521,0.00015705617261119187,0.0006307743606157601,0.00025286231539212167,0,0,0,0,0,0
"Nah, your friends also sound like douche bags and dirt bags as well at least if that's how they look at it. I know people who'd probably side with Scotty, and I don't consider them to be amazing people either to be honest. They all sound like people I could never trust that much. He sounds like a slime ball piece of shit.",red,0.06550663113594055,0.09358090162277222,0.0,,0.9064190983772278,0.020936835557222366,0.7779225707054138,0.0013466976815834641,0.7164028286933899,0.01954195275902748,1,0,1,0,1,0
"IA long time ago i knew a guy his name was Trent, real name.  He is the exact person you described but in high school. When I was younger I thought his behavior was cool something to be looked up to. I probably thought it was the boldness or competitiveness.  I thought was.  I realized later. He was not a good person, he was a serial abuser. Later i heard more of his exploits and am more disgusted.  That is the kind of guy that turns into a Epstein.  I cut out trent and anyway i might bump into him.  Ive avoided reunions for 30 years and professional meetings that I may bump into him.  That kind of guy is not your friend and doesn't respect you or anyone else. That kind of guy doing that is like someone coming into your house and taking a dump in your living room floor and thinking its funny.  That kind of guy will take you down as well, when he gets rolled up. If you're going to hang out with him. ",yellow,0.6993721296079456,0.9991030422970653,0.0,,0.000896957702934742,0.0001072431550710462,0.00019894682918675244,0.00010911217395914719,0.00019103543309029192,0.00013767143536824733,0,0,0,0,0,0
