text,badge_color,final_score,model_cred,heur_score,heur_tips,prob_toxic,prob_severe_toxic,prob_obscene,prob_threat,prob_insult,prob_identity_hate,pred_toxic,pred_severe_toxic,pred_obscene,pred_threat,pred_insult,pred_identity_hate
"Theguybehindthesofa, please check the sidebar for the rules of this sub! If this post violates the rules, *PLEASE* check and report this post!

***
Recommended Subs |
:---------------: |
r/OffMyChestUnfiltered |
r/WhatMenDontSay |
r/AskMenRelationships |
***

[Automoderator has recorded your post to prevent repeat posts.]

Your post has NOT been removed.

Theguybehindthesofa updated the post:

So I have this friend ""Scotty"" (Fake name). We enjoy hanging out a lot, but our conversation left me stunned and disgusted. It was on the weekend, we were watching netflix whilst he got a little buzzed ( I don't drink for both religious and personal reasons) and he basically admitted to me that he enjoys sleeping with married women/women in committed relationships. 

I was pretty shocked, one because that's an incredibly shitty thing to do and two because whenever infidelity would come up he would always say how much he hated cheaters, how they were all terrible people who deserved to be punished etc. (so cheating is bad, but *helping* people cheat is fine? Ok bud.)

I immediately told him he was gross and a hypocrite but then he got all defensive and said that he never ""made any vows"" and that those women were ""probably going to cheat anyway."" He also made the point that it's better since it's less hassle and he doesn't have the expectations of a relationship. It got quite disturbing when he got into how much fun seducing them was and how he was making them feel things that their husbands never did etc. 

I told him to leave. He cussed me out and told our mutual friends how I was ""judging"" him for his lifestyle.  Some of them are on my side whilst a few are saying that's it's not my business and that I should let him be stupid and make mistakes whilst he is still young. One of them, a male cousin whom I respect and look up to, told me that Scotty's not the one ruining the marriages, the married women are and that I shouldn't blame him.

Obviously I want to cut Scotty out of my life but I'm feeling conflicted after hearing what my cousin and others had to say so idk, any thoughts? 


*I am a bot, and this action was performed automatically. Please [contact the moderators of this subreddit](/message/compose/?to=/r/AskMenAdvice) if you have any questions or concerns.*",yellow,0.6981195990694686,0.9973137129563838,0.0,1 profane term(s).,0.0026862870436161757,8.615126716904342e-05,0.00026133679784834385,0.00010960166400764138,0.00024966063210740685,0.0001470601127948612,0,0,0,0,0,0
"Your friend is shitty but no one is forcing those women to cheat.

But your friend is shitty especially with him cussing you out to your other mates, I would drop him.",red,0.033797878026962276,0.0482826828956604,0.0,,0.9517173171043396,0.021004626527428627,0.8181045651435852,0.0010468409163877368,0.7044643759727478,0.009587666019797325,1,0,1,0,1,0
">Your friend is shitty but no one is forcing those women to cheat.

You're correct there.....BUT, the fact he seeks these women out, IMO, makes him as equal of a pos as the cheater.",red,0.047663015127182004,0.06809002161026001,0.0,Repeated punctuation.,0.93190997838974,0.015931684523820877,0.7592946290969849,0.0010095190955325961,0.6142430305480957,0.012982320040464401,1,0,1,0,1,0
"Yeah, the fact he goes out of his way really scares me. 😭",yellow,0.6796113034710287,0.9708732906728983,0.0,,0.029126709327101707,0.00015843077562749386,0.0012612951686605811,0.00032079487573355436,0.0007392530096694827,0.0002446891739964485,0,0,0,0,0,0
Where is he finding all these married women?,yellow,0.6894528073258698,0.9849325818940997,0.0,,0.015067418105900288,0.0001023251170408912,0.0003264830738771707,0.0001337638241238892,0.0006826436729170382,0.00045701564522460103,0,0,0,0,0,0
"Asking for a friend,  correct?",yellow,0.6995130819152109,0.9993044027360156,0.0,,0.0006955972639843822,0.0001142266919487156,0.00017653089889790863,0.0001121535460697487,0.0001819443714339286,0.0001394002028973773,0,0,0,0,0,0
😂😂,yellow,0.6963385174050927,0.9947693105787039,0.0,,0.00523068942129612,0.00010386233043391258,0.0003794920048676431,0.00011249703675275669,0.0002816009509842843,0.00017145067977253348,0,0,0,0,0,0
yeah he's asking for me,yellow,0.6993301814829465,0.9990431164042093,0.0,,0.000956883595790714,0.00010606969590298831,0.0002064323052763939,0.00011153284140164033,0.00016726825560908765,0.00013089043204672635,0,0,0,0,0,0
Probably in his imagination.,yellow,0.6994427368394098,0.9992039097705856,0.0,,0.0007960902294144034,0.00011163637100253254,0.00018612439453136176,0.00010309808567399159,0.00019539745699148625,0.00014402455417439342,0,0,0,0,0,0
"In OP’s imagination….  Reddit has been carpet bonbed with these weird posts from ‘religious ‘ people, asking Jack-assy questions that they should be able to figure out on their own.",yellow,0.64909797757864,0.9272828251123428,0.0,,0.07271717488765717,0.00042949168710038066,0.017286553978919983,0.0002380623045610264,0.0071892631240189075,0.0007308553904294968,0,0,0,0,0,0
"This post is also clearly written by AI. It's got the same structure as every one of these other posts. Just because people have learned to take the em dashes out, it's still obvious when these are ChatGPT generated posts.",yellow,0.6995501942990813,0.9993574204272591,0.0,,0.0006425795727409422,0.0001196163721033372,0.00018687036936171353,0.00011956424714298919,0.00017862078675534576,0.00013803871115669608,0,0,0,0,0,0
I have a friend who is the same dude. You would've surprised at how many women are looking for this guy lol,yellow,0.6659719217568636,0.9513884596526623,0.0,,0.04861154034733772,0.0002567003248259425,0.004537397995591164,0.00019393872935324907,0.0021637927275151014,0.0006227659760043025,0,0,0,0,0,0
What people seem to be missing is that the reason the guy is doing it is that he knows there’s no strings attached and they’re not gonna want anything else from him.,yellow,0.699156022479292,0.99879431782756,0.0,,0.0012056821724399924,9.986287477659062e-05,0.00020514338393695652,0.00010859381291083992,0.0001801066246116534,0.0001356278226012364,0,0,0,0,0,0
Your friend has a death wish.  All it takes is sleeping with the wrong person whose husband is vengeful and violent.,red,0.07540388703346251,0.10771983861923218,0.0,,0.8922801613807678,0.010445165447890759,0.05418027937412262,0.21720819175243378,0.09805714339017868,0.0152738681063056,1,0,0,0,0,0
"++woman what's going out of your way to sleep with married women?

does he crash like baby showers or something? 

is there a married women's ball or something?",yellow,0.5530971884727478,0.790138840675354,0.0,,0.209861159324646,0.00030187543598003685,0.004666491411626339,0.00046455077244900167,0.005927983205765486,0.0022205780260264874,0,0,0,0,0,0
Hey Mom ! Where’s the Meatloaf ??,yellow,0.6460338324308394,0.9229054749011993,0.0,,0.07709452509880066,0.00016942610091064125,0.0026423917151987553,0.00019947886175941676,0.0025354803074151278,0.00035462240339256823,0,0,0,0,0,0
Crashes Weddings and Funerals,yellow,0.6994314779993146,0.9991878257133067,0.0,,0.0008121742866933346,0.00011166245531057939,0.0001781178725650534,0.00012756172509398311,0.00018555240239948034,0.00014151522191241384,0,0,0,0,0,0
Friend is shitty but he's not the one that's taken a oath those the husbands (or wives) of these women,red,0.04938201308250427,0.0705457329750061,0.0,,0.9294542670249939,0.023563606664538383,0.8315297961235046,0.0012073215330019593,0.5768586993217468,0.021832404658198357,1,0,1,0,1,0
Not equal.,yellow,0.699336624587886,0.9990523208398372,0.0,,0.0009476791601628065,0.00010805615602293983,0.0001892345171654597,0.00010163264232687652,0.00018635063315741718,0.0001487818663008511,0,0,0,0,0,0
"It’s not really equal at all. As someone whose fiancée cheated on him there is no end of guys who will fuck your wife. 

Very few showed any care that they were messing with a relationship. Most actually liked that fact. 

If a woman wants to cheat hoping that a guy is going to have the decency not take advantage is nuts. Find a woman who isn’t going to make you worry.",red,0.03114206790924072,0.04448866844177246,0.0,,0.9555113315582275,0.027121009305119514,0.8813623785972595,0.002013065852224827,0.4452175199985504,0.007559834513813257,1,0,1,0,0,0
">Your friend is shitty but no one is forcing those women to cheat.

True no one is forcing them to cheat.  But his friend is responsible for his actions, which is to be a destructive force by enabling.



OP, you are under no obligation to share your presence with anyone.  You get to choose who you allow in your life and who you gift your presence and nature to.  If your friend does not align with what you want to share in your life, separate yourself from him.  Nobody else's opinion matters, they can pick for their lives",red,0.12741780281066895,0.18202543258666992,0.0,,0.8179745674133301,0.006345508620142937,0.5898352265357971,0.0011399720096960664,0.29110559821128845,0.0059369648806750774,1,0,1,0,0,0
"If you got into a committed relationship, would he cheat with your significant other? What guarantees would you have, knowing his past? He’s untrustworthy. That’s the end of it.",yellow,0.6734519619494677,0.9620742313563824,0.0,,0.03792576864361763,0.00015201055794022977,0.0017648242646828294,0.0002624459157232195,0.0014040465466678143,0.00034054796560667455,0,0,0,0,0,0
"Not forcing, but he is encouraging and providing the women a dick to fall on to for cheating, and that, to me, is even a bigger d-bag move than having a public mouth-off with one's mates.",red,0.07281616926193236,0.10402309894561768,0.0,,0.8959769010543823,0.016088156029582024,0.8118543028831482,0.0016768337227404118,0.22897149622440338,0.0068074604496359825,1,0,1,0,0,0
"Two things can both be true:

\- he isn’t a good guy sleeping with married women.  

\- the women are responsible for their infidelity, not him.  The chose to sleep with him so they are responsible for their marriage and not him.",yellow,0.6372398748993873,0.9103426784276962,0.0,,0.08965732157230377,0.00033697657636366785,0.007298012729734182,0.0003553596616256982,0.003617721376940608,0.0011390753788873553,0,0,0,0,0,0
"This pretty much. BOTH people in this situation can be scumbags. The women shouldn't cheat on their SO's, but this guy shouldn't be ENCOURAGING this either. One doesn't cancel out the other and somehow make them less terrible.

Both parties are assholes and there's nothing wrong with cutting this guy out of your life.",red,0.07673122882843017,0.10961604118347168,0.0,,0.8903839588165283,0.019156809896230698,0.7104398012161255,0.0025778186973184347,0.6590633392333984,0.03956836089491844,1,0,1,0,1,0
Thanks.,yellow,0.6995749026944394,0.9993927181349136,0.0,,0.0006072818650864065,0.0001253167138202116,0.0001928310957737267,0.00011650355736492202,0.00017581212159711868,0.00013912982831243426,0,0,0,0,0,0
"So the question is, do you want to be friends with someone who is so comfortable being a scumbag? and do you want a friend that if you question their known scumbag behaviour, they will cuss you out? 

Sounds like a misalignment of values, which is the most common reason for a friend breakup",red,0.24794830679893493,0.35421186685562134,0.0,,0.6457881331443787,0.007163975853472948,0.2531041204929352,0.002791344653815031,0.4982234537601471,0.039389416575431824,1,0,0,0,0,0
"He could try to 'seduce' OP's partner, or any of OP's mutual friend's partners as well, hilariously enough. Wonder if they'd shrug their shoulders while sobbing after finding out of infidelity and still have the balls to go ""well, Scotty, she would've cheated with anyone, might as well have been a good friend like you!"" lmao",yellow,0.6453729778528213,0.9219613969326019,0.0,Includes quotes/citations.,0.07803860306739807,0.00018759697559289634,0.002863651840016246,0.0002980070421472192,0.006782189477235079,0.0006409140769392252,0,0,0,0,0,0
"++man, hahaha! That would be a hilarious outcome for OP’s cousin.",yellow,0.6959877356886863,0.9942681938409805,0.0,,0.00573180615901947,8.81603846210055e-05,0.0004212041385471821,0.00010615075007081032,0.0003570266126189381,0.0001612623018445447,0,0,0,0,0,0
"The downvotes will come, but…

It’s not *my* responsibility to keep the sanctity of someone else’s marriage intact.  I didn’t take those vows.  Even a total POS like the dude OP is talking about is still less culpable than the women.",yellow,0.6746849440038204,0.963835634291172,0.0,,0.03616436570882797,0.00021772329637315124,0.0050516678020358086,0.00021970647503621876,0.0012693475000560284,0.0002777914342004806,0,0,0,0,0,0
"The women share responsibility, but to say he's not responsible is false. Everyone has moments of weakness, none of us are saints. Most of us could probably be swayed to do something wrong if the right person made the right argument at the right time. This guy mentions that he seduces women, so it's not like these are women who are throwing themselves at him - they're clearly in a weakened state, and he's exploiting that weakness.

Put it another way: if my wife cheated on me with another man, and I found out that guy had been soliciting my wife for weeks or months? You damn well bet that guy is not going to be blameless in my mind.

The alternative would be a virtuous man who tries to remind women who are interested in him that they should work things out in their own relationship. A more twisted form of virtue would be someone who feels he's helping women to realize their desires, and to recognize that they're unhappy in their relationships. But that's not what this guy is doing. He's claiming cheaters are terrible, and is then encouraging acts of infidelity while making them real. Like it or not, he's a cheater, too. If he doesn't recognize the boundaries of someone else's relationship, he's fooling himself if he thinks he'll respect the boundaries of his own relationship, if and when he has one.",yellow,0.6901517676189541,0.985931096598506,0.0,,0.014068903401494026,0.00013906390813644975,0.0011161015136167407,0.00016386671632062644,0.000704828358720988,0.0003371745115146041,0,0,0,0,0,0
"If your wife was being solicited for weeks or months and you only found out after she fucked another guy, my question would be why she entertained it for weeks or months, why she kept it a secret from you for weeks or months. Then I'd suggest maybe, just maybe, she let it happen because she wanted it to happen and maybe she had agency in being seduced as he has agency in seducing.",red,0.13565343022346496,0.19379061460494995,0.0,,0.80620938539505,0.008584129624068737,0.7178504467010498,0.0017133973306044936,0.1802242398262024,0.004211380612105131,1,0,1,0,0,0
"Exactly he is simply making excuses for his trash wife, cheating happens after a series of bad choises not a accident.",red,0.41990461647510524,0.599863737821579,0.0,1 profane term(s).,0.400136262178421,0.0006293890182860196,0.04131580516695976,0.0002585836627986282,0.03414140269160271,0.0008578982669860125,0,0,0,0,0,0
"Bingo 🤯, Get this dude a beer! Very impressive, logical takedown, of a thinly veiled lowered expectation for someone who actually doesn’t deserve it!",yellow,0.6771624941378831,0.9673749916255474,0.0,,0.03262500837445259,0.00011682762851705775,0.0012832657666876912,0.00018431262287776917,0.0014184321044012904,0.00033832824556156993,0,0,0,0,0,0
"Nah, dude is not at fault for any marital problems, he’s not part of it. Blame for the marriage issues as a result is 100% on the women willing to cheat.

Does he make it easier for them? Yeah.

Is he giving them an opportunity they may have otherwise avoided? Yep.

Is it still on them to be big girls (or boys whatever) and do the hard thing? Yep.

Is he a douche? Also yes.",yellow,0.5761789605021477,0.8231128007173538,0.0,,0.17688719928264618,0.0006456449627876282,0.03145797923207283,0.00028274269425310194,0.019201230257749557,0.0015986840007826686,0,0,0,0,0,0
"Life is full of temptations. Onus is on you to resist and navigate through it.

If I was fat and unhealthy because I can't stop buying/eating junk food, can I say the supermarkets/big coprorations share equal responsibiltiy for my ill health? Its their fault for making junk food so cheap, accessible, affordable and addictive! They shouldn't have adertised on TV and social media!",yellow,0.5794826805591583,0.8278324007987976,0.0,,0.1721675992012024,0.0002405167033430189,0.0030348789878189564,0.0005630986415781081,0.005185900721698999,0.001689369441010058,0,0,0,0,0,0
"Nobody cheats on their partner in a moment of weakness. Cheating isn’t a mistake; it’s a conscious decision, and usually a string of conscious decisions, any one of which could have stopped the infidelity. 

This guy is a scumbag, but don’t try to justify the women’s role in this as some kind of mistake in a moment of weakness. Because it isn’t, by any stretch of the imagination.",red,0.39485940039157863,0.5640848577022552,0.0,,0.43591514229774475,0.0021720044314861298,0.08631529659032822,0.0011325360974296927,0.21885794401168823,0.018202858045697212,0,0,0,0,0,0
"If women lied to him, he would be blameless. Seducing and fucking married women knowingly makes him an asshole.",red,0.0013057708740234373,0.001865386962890625,0.0,,0.9981346130371094,0.2912219166755676,0.9878938794136047,0.004097829107195139,0.9152162075042725,0.04597708582878113,1,0,1,0,1,0
"OP idk if you’ll see this considering there’s so many comments but I had a best friend like this for 5 years. The longer I knew her I realized how bad of a person she was. She had zero morals (among other things she did I had issues with). She cheated in every single relationship she was in as well. 

She slept with everyone’s boyfriends, even her “best friends” boyfriends. Never came clean unless caught red handed. She never even felt bad about it either and always found some way to justify it or would just say stuff like “I was just being shitty hehe” but with like a “whoops” kinda attitude. 

And then ofc she had the audacity to call all these woman “crazy” when they reached out to her about her sleeping with their man, and she always denied it to protect herself. She also never got tested and spread STD’s to others and didn’t care at all, she never disclosed anything. She was a very pretty girl so everyone wanted to fuck her/did fuck her. 

I was naive most of our friendship thinking I was special enough to her that she wouldn’t do that to me. All it took was me going to the bathroom and leaving her around my bf (now ex) for her to start talking sexual to him behind my back.

It took me a long time to cut her off completely because we were such close friends, but I knew deep down I could never trust her. After that incident she never met any of my future boyfriends ever again. She also would confide in me looking for sympathy in all these situations and I always told her she was in the wrong. “It takes 2 to tango” was always one of her excuses as well. Just cut this guy off. He will 100% do it to you as well, or he will at the very least try.",yellow,0.49658319056034084,0.7094045579433441,0.0,,0.2905954420566559,0.001708442228846252,0.18457834422588348,0.0005092317005619407,0.03431348502635956,0.001443651388399303,0,0,0,0,0,0
Her and Scotty should get together to save everyone else from their toxicity. 😭😂,yellow,0.6979291096096858,0.997041585156694,0.0,,0.0029584148433059454,0.000104329468740616,0.0001707008050289005,0.00017552483768668026,0.00028783208108507097,0.00023028683790471405,0,0,0,0,0,0
Dudes playing a dangerous game lol. One of those husbands might lose their shit one day,red,0.02352982759475708,0.03361403942108154,0.0,,0.9663859605789185,0.023375431075692177,0.8408976793289185,0.004212194588035345,0.2627080976963043,0.0037774494849145412,1,0,1,0,0,0
"Yep all it takes is one of the husbands finding out, asking his wife who it was, she answers “Scotty” and next thing you know Scotty gets his ass beat.  I’m not condoning that, but in some situations the husbands think the guy is the problem instead of the one who went outside the marriage.",red,0.35791366994380946,0.5113052427768707,0.0,,0.4886947572231293,0.006997215561568737,0.46087217330932617,0.0061083449982106686,0.11170510202646255,0.008558334782719612,0,0,0,0,0,0
"A guy I knew from high school(he was 19), got involved with a married woman. Her husband found out, chased them in a vehicle, shot the guy while he was driving, they crashed, the husband got out, shot his wife and then himself. An ass beating isn't even the worst that could happen. ",red,0.35657118260860443,0.5093874037265778,0.0,,0.4456440210342407,0.00515007646754384,0.49061259627342224,0.002035236218944192,0.06403759121894836,0.00394695857539773,0,0,0,0,0,0
Oh shit dude. 👀,red,0.022097843885421752,0.03156834840774536,0.0,,0.9684316515922546,0.037705350667238235,0.9143199920654297,0.001839876757003367,0.09273137897253036,0.0018175124423578382,1,0,1,0,0,0
"As somebody whose wife cheated on me, I don't really give a shit whether it's my wife's fault or his (it was hers), I'm still beating him blind. ",red,0.023523610830307004,0.03360515832901001,0.0,,0.96639484167099,0.05275959149003029,0.8319504261016846,0.10375948995351791,0.17054788768291473,0.007975787855684757,1,0,1,0,0,0
If you knowingly get involved with someone you know is in a relationship I say you deserve whatever comes your way because of it,yellow,0.6836664345115423,0.976666335016489,0.0,,0.02333366498351097,0.00013191763719078153,0.0007390357786789536,0.0005215236451476812,0.0008282302878797054,0.00033712503500282764,0,0,0,0,0,0
"One of those husbands WILL lose their shit one day, they only question is will he stop before that happens?",red,0.03451113700866699,0.0493016242980957,0.0,,0.9506983757019043,0.019858695566654205,0.8143038153648376,0.005697708111256361,0.12819045782089233,0.003357968060299754,1,0,1,0,0,0
You got that right. A lot of men blame the guy right away for f****** their wife.,red,0.04738918542861938,0.06769883632659912,0.0,,0.9323011636734009,0.02269052341580391,0.8838384747505188,0.0012824971927329898,0.1983119398355484,0.003380841575562954,1,0,1,0,0,0
I would blame both but I probably wouldn't beat my wife. ++man,yellow,0.576956045627594,0.8242229223251343,0.0,,0.17577707767486572,0.0007625623838976026,0.013434945605695248,0.005003860220313072,0.0023583341389894485,0.0014547810424119234,0,0,0,0,0,0
"Right. And not all of them are going to agree its their spouses fault for cheating, they are going to go after him ",yellow,0.6814937626942992,0.9735625181347132,0.0,,0.026437481865286827,0.00018752668984234333,0.0008499175310134888,0.0011176159605383873,0.0007733742240816355,0.0005091805360279977,0,0,0,0,0,0
"He has made it obvious. If you have a female SO, he will try to sleep with her. Something to keep in mind if you continue to be his friend",yellow,0.6665432538837194,0.9522046484053135,0.0,,0.04779535159468651,0.00026099765091203153,0.0016972075682133436,0.0013655090006068349,0.0012924161273986101,0.000872500182595104,0,0,0,0,0,0
This whole situation is messing me up and caused me to see a lot of people in a new light. I'm leaning more toward cutting him out.,yellow,0.6956764391623437,0.9938234845176339,0.0,,0.006176515482366085,0.00011059029202442616,0.00043904950143769383,0.00015055807307362556,0.0003229761205147952,0.00020392549049574882,0,0,0,0,0,0
"You already know what to do man, good luck!",yellow,0.6995468935579993,0.9993527050828561,0.0,,0.0006472949171438813,0.00012989487731829286,0.0001832533162087202,0.00015788982273079455,0.00018593603454064578,0.0001504726824350655,0,0,0,0,0,0
"Think about it this way also, any SO you have is going to see what kind of friends you associate with.  If you are okay hanging with someone like that it says something about you.",yellow,0.6991555971791967,0.9987937102559954,0.0,,0.0012062897440046072,0.00010457368625793606,0.00017582601867616177,0.00012998942111153156,0.0002026783040491864,0.00015516557323280722,0,0,0,0,0,0
"If you're worried he will make threats, remember to not block but rather to mute his number so you wont be bothered by notifications but if he texts dumb shit like threats of violence, you will have a text confirmation of the threat",red,0.1936358571052551,0.2766226530075073,0.0,,0.7233773469924927,0.006268414203077555,0.5153017044067383,0.0054070535115897655,0.07603160291910172,0.00332165090367198,1,0,1,0,0,0
"Also, what other morals is this ""friend"" lacking?  What other ways would he willing watch someone else get fucked over and not care?

The attitude of ""he's not the one cheating"" and ""if it wasn't him it would be someone else"" is missing two things. 1) The friend is morally bankrupt, and 2) That kind of a lack of morals won't be limited to only married women.

The friend is telling you he's a piece of shit.  Listen to him.",red,0.02803598046302795,0.040051400661468506,0.0,Includes quotes/citations.,0.9599485993385315,0.02923228219151497,0.872556746006012,0.0013566402485594153,0.6551773548126221,0.016698719933629036,1,0,1,0,1,0
"Be mindful who you choose to be around. Birds of a feather, flock together.",yellow,0.6994881203689146,0.9992687433841638,0.0,,0.0007312566158361733,0.00011734522558981553,0.00016244634753093123,0.00013273832155391574,0.0001849060063250363,0.0001482744119130075,0,0,0,0,0,0
"I slept with a married woman in the past. She lied to me, in a really messed up way. When I found out the truth it broke me on a fundamental level. I cant image someone making that choic over and over.",yellow,0.6968529928009957,0.9955042754299939,0.0,,0.004495724570006132,0.00012589113612193614,0.0006408172775991261,0.00012441040598787367,0.0003066982899326831,0.0001757365243975073,0,0,0,0,0,0
