text,badge_color,final_score,model_cred,heur_score,heur_tips,prob_toxic,prob_severe_toxic,prob_obscene,prob_threat,prob_insult,prob_identity_hate,pred_toxic,pred_severe_toxic,pred_obscene,pred_threat,pred_insult,pred_identity_hate
"Only one aspect of this is both within your control AND also your business: whether to stay friends with him. 

If you want to stay friends, then make it clear that you don’t ever want to hear about these affairs again. If you don’t want to stay friends, then stop being friends with him.",yellow,0.6994758167769759,0.9992511668242514,0.0,,0.0007488331757485867,0.00011822093074442819,0.00016846309881657362,0.00014184742758516222,0.00018340749375056475,0.00014658244617749006,0,0,0,0,0,0
This dude is a complete POS. He is beyond redemption and you should just cut him out of your life. He’s gonna bang the wrong guy’s gal someday and wake up underground. Leave him in the sewer where he belongs and don’t put anymore thought to it.,red,0.023488271236419677,0.033554673194885254,0.0,,0.9664453268051147,0.05214852839708328,0.2193371057510376,0.5994883179664612,0.472256600856781,0.040519244968891144,1,0,0,1,0,0
"you have been a better friend to scotty than those who would rather knowingly let him 'make mistakes'. 

he made it your business, and it would have been wrong to not give him the only logical response. 

now, let's revise that posture towards your halfwit cousin. ++incognito",yellow,0.6865164350718259,0.9807377643883228,0.0,,0.01926223561167717,0.000108956744952593,0.000743070209864527,0.0001760791928973049,0.001996868522837758,0.0003600200288929045,0,0,0,0,0,0
"Tell Scottie that Fiona and me do it in my van every Sunday. 

She tells him she’s at church, but she doesn’t go, still she’s on her knees and Scottie doesn’t know!",yellow,0.6781011682003736,0.9687159545719624,0.0,,0.03128404542803764,0.0001442319480702281,0.0014253922272473574,0.00026490504387766123,0.000891948991920799,0.00030557726859115064,0,0,0,0,0,0
Ask him to get off his high horse and admit that he has a kink for this shit.,red,0.023765188455581662,0.03395026922225952,0.0,,0.9660497307777405,0.02973320335149765,0.900708019733429,0.0017325248336419463,0.22606132924556732,0.003469546092674136,1,0,1,0,0,0
"Your cousin you look up to is wrong, and probably already did something like that in the past if says that kind of nonsense.


He absolutely does cause then to cheat. And does so bcuz it's ""fun"" and convenient. But jn reality it's an addiction. 


So yeah, you did right.",yellow,0.6399993985891341,0.9142848551273346,0.0,,0.0857151448726654,0.00017710885731503367,0.003300533164292574,0.0002674703428056091,0.005630281288176775,0.0005433826590888202,0,0,0,0,0,0
Drop him before he comes after your girlfriend or wife.,red,0.40146646499633787,0.5735235214233398,0.0,,0.42647647857666016,0.0020705617498606443,0.006803812459111214,0.05531388893723488,0.00792077649384737,0.003604680299758911,0,0,0,0,0,0
"This guy sounds like a perverted asshole regardless of whether or he’s responsible for those women cheating.

You said he says cheaters are shitty people, which means he’s bragging about seducing shitty women he disrespects and being able to easily dispose of them afterwards because their in relationships. What does that tell you?

That alone is disturbing, as you mentioned, and the hostility he showed you after you called him out on it makes it worse.

I’d be embarrassed to be his friend.",red,0.024031466245651244,0.034330666065216064,0.0,,0.9656693339347839,0.03636203333735466,0.8813801407814026,0.001101338304579258,0.7908657193183899,0.01797647587954998,1,0,1,0,1,0
It’s fun and games until one of their husbands unloads a 12 gauge in his face 🤷🏽‍♂️. Even the weakest man would kill a man over a woman.,red,0.39105887115001675,0.5586555302143097,0.0,,0.4413444697856903,0.0021327699068933725,0.015775984153151512,0.03469673916697502,0.015189163386821747,0.011418958194553852,0,0,0,0,0,0
You should change your friend’s pseudonym to Donny since I suspect there are many a Scotty out there who don’t know. Oh yeah - and I’d drop him - sounds like he has some psychological stuff to work out but probably not super healthy to hang out with in the meantime and he’d probably do the same to your significant other if he was interested and had the chance.,yellow,0.697780253435485,0.9968289334792644,0.0,,0.0031710665207356215,8.958745456766337e-05,0.00024539988953620195,0.00013816960563417524,0.00031523758661933243,0.00018581602489575744,0,0,0,0,0,0
If you don't like how your friend is acting and they do not take your advice you should end the friendship. That is the case for all friendships. You choose your friends so do not surround yourself with people who suck.,red,0.10937195420265197,0.1562456488609314,0.0,,0.8437543511390686,0.005064165219664574,0.5229918360710144,0.0005776607431471348,0.40653446316719055,0.0027435212396085262,1,0,1,0,0,0
"++woman You don’t need a reason to cut Scotty out, you can do what you want without justifying it to others. But, not wanting to be around his lifestyle is perfectly also a perfectly acceptable reason, if you need one.",yellow,0.6660365901887416,0.9514808431267738,0.0,,0.048519156873226166,0.00014037165965419263,0.0020051682367920876,0.000330337235936895,0.0014731311239302158,0.0004232391365803778,0,0,0,0,0,0
"Knew a girl who would sleep with married/taken dudes. 

I tried explaining to her that it was wrong. She kept telling herself that she's not in the wrong since she's free to do as she pleases, and that the guys were for sleeping with her. I tried explaining to her that more than one person can be in the wrong but pretty sure there was some screw loose with this one. I cut her out if my life but still hear about her occasionally due to overlapping friends. 

She's in a relationship now. I sure hope she finds out what it feels like.",yellow,0.6162821970880031,0.8804031386971474,0.0,,0.11959686130285263,0.0007547480054199696,0.04756652191281319,0.000685884733684361,0.006220219191163778,0.0008472229819744825,0,0,0,0,0,0
"He’s an egotist and gets a buzz out of getting those women to cheat, but also he knows that he can just walk away without any commitment, so essentially he’s a coward as well.",red,0.09968302249908446,0.14240431785583496,0.0,,0.857595682144165,0.0026891655288636684,0.08651255071163177,0.0009104255586862564,0.43359217047691345,0.019543349742889404,1,0,0,0,0,0
May he sleeps with ur wife in future or with a wife of ur friends or wife of ur cousin. He is trash,red,0.04501596689224243,0.0643085241317749,0.0,1 profane term(s).,0.9356914758682251,0.006111993920058012,0.31302183866500854,0.0009210360003635287,0.5632627606391907,0.017175445333123207,1,0,0,0,1,0
"He lacks integrity, you called him out on it, he doesn't care. If this type of integrity is important to you and you want to surround yourself with people you can respect you should tell him that and not seek out his company any more.

Edit

There's always people who don't care enough about certain things (like cheating) to make it a hill to die on, so to speak. I doubt any of the people who are so forgiving of his behavior (like his cousin) would be so forgiving to the random strange guy if their girlfriend or wife were to cheat on them.",yellow,0.6920348722487688,0.9886212460696697,0.0,,0.011378753930330276,0.000108694403024856,0.0005494194920174778,0.00021592347184196115,0.0005702676135115325,0.0002790379512589425,0,0,0,0,0,0
"Would you trust him around your woman in light of this knowledge ?

Your answer will inform your decision.",yellow,0.687268366292119,0.9818119518458843,0.0,,0.018188048154115677,0.00012004932796116918,0.0012005777098238468,0.0002361603401368484,0.000675799383316189,0.00027802353724837303,0,0,0,0,0,0
++man the thing is doing this is like carrying multiple targets on your back. You never know who’s gonna loose their shit one day and dear susie might just say you induced her to do this and good luck after that.,red,0.23954728841781614,0.34221041202545166,0.0,,0.6577895879745483,0.0059644971042871475,0.6195231676101685,0.002261391608044505,0.11085094511508942,0.0035303193144500256,1,0,1,0,0,0
"Honestly thank you for calling him out.

I hate guys like this. I can't count the number of times I've told a guy trying to hit on me ""I'm married"" and they treat it like a challenge instead of a respectful stop acting like that sort of way.

The ones who do cheat are shit wives but the number of women he's probably chased and made feel uncomfortable... He just adds to the negative stereotypes all guys then suffer for",yellow,0.47449561059474943,0.6778508722782135,0.0,Repeated punctuation.,0.3221491277217865,0.001910506747663021,0.18563500046730042,0.0008705187356099486,0.027551136910915375,0.0027874570805579424,0,0,0,0,0,0
"Sounds like your friend is living in a fantasy world.  I had a friend who told me the same , that he has a problem and he always hooks up with married women, years ago.  Guy was 250lbs and not very good looking.  His own cousin called him out, I just felt bad for him.  I would just let him believe what he wants.  Sometimes people lie to themselves to boost their own ego when they have nothing else.",yellow,0.6931058161891996,0.990151165984571,0.0,,0.00984883401542902,0.00010470180859556422,0.00041363967466168106,0.00011680879833875224,0.0007528899586759508,0.0003282239194959402,0,0,0,0,0,0
"That’s a lot of karma coming back to him. One day, it will catch up to him. FYI, it’s only 4-6 years for killing during a crime of passion. Or so I heard.",yellow,0.6836464960128068,0.976637851446867,0.0,,0.02336214855313301,0.00018263162928633392,0.0015029801288619637,0.0006032664678059518,0.0010915372986346483,0.0005281206103973091,0,0,0,0,0,0
"You are the company you keep.   If you morally don’t align with him being an absolute scumbag, dump his ass.  He ain’t worth having as a friend.  I’d dump any mutual friend that agreed with his stance too, personally.  That bullshit argument of ‘he’s not in a relationship—they are’ doesnt stick. That only matters if he didnt know.  He chases taken women, he’s a piece of shit.",red,0.013668036460876463,0.019525766372680664,0.0,,0.9804742336273193,0.04891684278845787,0.8956588506698608,0.001426644274033606,0.8863549828529358,0.021673161536455154,1,0,1,0,1,0
