"text","toxicity","severe_toxicity","obscene","threat","insult","identity_attack","sexual_explicit"
"I've never had nor heard a pub conversation like that.  

The conversations I hear are about getting ripped off at the gas pumps, the outrageous amount people pay for cable, internet and cell phones and how they haven't received a raise in years all while they complain about their bosses trip somewhere or weekend at the cottage.

What world do you live in?

MrC","0.0","0.0","0.0","0.0","0.0","0.0","0.0"
"Perhaps there was voter fraud in 2016. How else would a reality show host that is as phony as a $3 bill get himself elected president?","0.20000000298023224","0.0","0.0","0.0","0.10000000149011612","0.0","0.10000000149011612"
"You must have roses in your eyes.  Clint Eastwood showed how diversity wrecked his once great  neighborhood .  Gangs took over . Crime increased.  Same thing is happening in Anchorage.","0.0","0.0","0.0","0.0","0.0","0.0","0.0"
"If you wanted a MLB stadium at that site, that ship sailed a couple of decades ago (or are there people who still think that Portland being used as a ""competitive bid"" to sweeten the deal for Montreal's move to Washington was actually a real opportunity? Please.).  While there was a strange plan to retrofit the stadium for baseball only (was never going to be multi use, it would have been terrible for soccer or football and WAS terrible for soccer before this renovation).

If we ever get a baseball team, a new stadium which was purpose built for baseball would be most appropriate, not a rectangular sports field which just wasn't finished on one side for 80 years.  Multipurpose stadiums just meant they were terrible for everyone and for that reason we stopped building them in the 60s.","0.0","0.0","0.0","0.0","0.0","0.0","0.0"
"You mean there are STILL people hanging on to the Trumptanic. Brilliant! /s","0.0","0.0","0.0","0.0","0.0","0.0","0.0"
"What Russian invasion?","0.20000000298023224","0.0","0.0","0.0","0.0","0.20000000298023224","0.0"
"Episode 1: A New Hope... the masterpiece that started it all.","0.0","0.0","0.0","0.0","0.0","0.0","0.0"
"Yes please","0.0","0.0","0.0","0.0","0.0","0.0","0.0"
"I hope a million or more descend on Washington that day, and that millions more in local marches/gatherings around the country will add to that number.

Go get 'em, Ladies! And Bravo to the men who support them.","0.0","0.0","0.0","0.0","0.0","0.0","0.0"
"Rome wasn't the largest power - it was about half the size of the Chinese empire. Second, Rome was a Middle Eastern Empire, not a European one (9 out of its 10 largest cities were in Turkey, Egypt, Tunisia, Lebanon and Syria). 

The reason Rome was smaller than India and China was that it had a lower population. The Indus river valley and Yangtze River valley are more fertile, and support much higher populations than Rome's biggest river valley at the Nile.

Rome's mortal enemy was the Parthian Empire. They both defeated each other several times. But neither of them could completely destroy the other. The Parthian Empire was also a second level world empire.","0.0","0.0","0.0","0.0","0.0","0.0","0.0"
"Nowhere in the NT will you find that Jesus or His apostles attempted any social reforms.  The did not protest slavery, or any other societal ""injustice.""  They preached the gospel, which, if accepted, creates its own social reform.

This effort, while maybe well-intentioned, is one of those ""bypath meadows"" which distracts us from our main goal:  preaching the 3 angels' messages.","0.0","0.0","0.0","0.0","0.0","0.0","0.0"
"I like the option that we can use email to log in to leave a comment instead of our Facebook.

My concern is the majority who try to censor us minorities.","0.20000000298023224","0.0","0.0","0.0","0.0","0.0","0.0"
"I am so proud of this couple! To go through something as tragic as losing a child and turn it around to make sure that it doesn’t happen to another family.  I know SIDS has been around for years but I don’t think mothers or families are informed about this as they should be.  Thank you for the fundraising for the Owlet Baby Monitor, to keep this from happening to new mothers and families.  Leah and Robert you are making a difference after such a tragic loss.  I hope you find peace by helping others. Go “Aquene’s Army”!","0.0","0.0","0.0","0.0","0.0","0.0","0.0"
"You must wonder why drugs are illegal and why they don't allow them in prison.","0.0","0.0","0.0","0.0","0.0","0.0","0.0"
"It is a vey sudden 32% increase to variable costs for all businesses whether a small-town restaurant or Loblaw's. Add the outrageous taxes and energy prices. Businesses will adapt with fewer staff.  Clearly, this Premier has never run a business or even understands basic arithmetic. She has run Ontario into the ground on all her waste and mismanagement.","0.1666666716337204","0.0","0.0","0.0","0.1666666716337204","0.0","0.0"
"That would be the editors of the Oxford English Dictionary & the editors of the OE Thesaurus that produced the aforementioned definitions, not me. It would be the Bundestag that differs on the definitions in a legal perspective, as does our own government.

You're can't even tell the difference between an immigrant and a refugee and yet you expect that I should adhere to your *cough* wisdom? 

Just like on the issue of Trump demographics, I respond with evidence; in this case the very text of German law which proves your claims regarding a lack of limits on immigrants are patently false. You then plead ignorance and claim you'd rather discuss the issue of refugees rather than that of immigrants after pointing out that you are ignorance of the difference between the two.

You can't make this stuff up.","0.0","0.0","0.0","0.0","0.0","0.0","0.0"
"I am a resident of Grandview-Woodland, living under the dangling sword of renoviction. There's no word yet, but I live in an nearly-50 year-old apartment building, being carefully maintained just above dereliction level. I am 70 years old, in poor health (not because of drugs or alcohol), and my rent consumes 75% of my income. And of course the rent goes up every year. I have no idea where I can go when the eviction comes. I was born and raised in Vancouver. Even if I try to move to the very edge of the Vancouver area — Coquitlam, Mission, and so on, I will not find a home I can afford. Where will I go? How will I live? I am an multiple-award-winning writer/artist, but you know how well that pays. I would like to continue my arts career until I am too old to function, and I would also like to stay in my neighbourhood, and my city, where my friends are. I doubt if I can continue anything at all in the future that looms. A hex upon the greedy developers, and Mayor Robertson, their pal.","0.1666666716337204","0.0","0.0","0.0","0.1666666716337204","0.0","0.0"
"The Flames want free transit to their games for all ticket holders. Contrast that with: No free transit for those going to work. No free transit for those going to school. No free transit for those going to the hospital. No free transit for those going home after a night of one to many. 
As outlandish as that ask is, the Flames also want all revenue from the parking, including unrelated events, like The Stampede. 

The Flames, being the incredibly astute business people they are, should simply buy a piece of land( subject to successful permitting etc), build the facility, and go into business. Any conservative ought to understand that!","0.0","0.0","0.0","0.0","0.0","0.0","0.0"
"Thank you for the lecture, but request denied. Information is prevalent in the modern world, and in certain instances, a person does something so reprehensible, it is often cathartic for people to respond. Reprehensible like mowing down a kid and leaving them to die. A kid that lived in the neighborhood. You reserve judgement if you want, but please leave the pedantic speech for your kids.","0.4000000059604645","0.20000000298023224","0.10000000149011612","0.30000001192092896","0.20000000298023224","0.0","0.0"
"So glad to see Handy come out on top. So sad to be a taxpayer who funds the settlement on behalf of corrupt and disgusting commissioners. If you can't win an election honestly you don't deserve your office. Try to do better, please!","0.1666666716337204","0.0","0.0","0.0","0.1666666716337204","0.0","0.0"
"The race is now on to write the worst G&M. Article. Ever. And this may be it.............","0.20000000298023224","0.0","0.0","0.0","0.20000000298023224","0.0","0.0"
"LIAR LIAR PANTS ON FIRE......how dumb does he think we are.  We think justin is extremely dumb.  What a goof ball. He is gets in deeper and deeper over his head.  Time to hold him up as an adult and stop allowing him to think and speak.","0.78125","0.0625","0.09375","0.015625","0.75","0.03125","0.0625"
"Great we need a working set of rules. Keep trying... it's the American way. I'd like to see height limits raised. Construction cost are rising too fast. We have 2.7% unemployment. We need to get these guys into  construction.","0.0","0.0","0.0","0.0","0.0","0.0","0.0"
"Both the left and the right have succumbed to the allures of identity politics. Heat not light. Tribal belonging not civic duty. Shaming and conformity instead of liberal pluralism. Us vs them. 

Moderate centrists must fight off polarizing populism from both flanks. It doesn't help to pretend it's only one side of the spectrum that plays those games.","0.0","0.0","0.0","0.0","0.0","0.0","0.0"
"Excellent post. My observation was that the Officers were over their heads and had no idea how to deal with this. Poorly trained.  Police work is not a 'club' it is is a dangerous job, and it looks like they have hired and trained poorly qualified individuals. This makes the whole scenario ever scarier.","0.1666666716337204","0.0","0.0","0.0","0.1666666716337204","0.0","0.0"
"If we are so unpleasant why waste time reading our comments?","0.0","0.0","0.0","0.0","0.0","0.0","0.0"
"Supply managed dairy is on its way out.    Here comes the BGH milk.   I'll drink it doesn't affect americans.","0.0","0.0","0.0","0.0","0.0","0.0","0.0"
"Interesting... I drive ALL DAY and I rarely see what you are talking about... where do you drive specifically?","0.0","0.0","0.0","0.0","0.0","0.0","0.0"
"The simple fact that the science this legislation is based on cant stand to legitimate, objective scientific debate and questioning warrants nothing less that principled rejection of it. A legislated conclusion to a field of scientific inquiry that our own government readily admits is still in its infancy is about the  most fundamentally flawed way of conducting science and clearly shows this is all based on ideology over knowledge or truth. Let the book burnings commence...","0.0","0.0","0.0","0.0","0.0","0.0","0.0"
"He'll enjoy himself there.  He'll be the little b***h he always wanted to be.","0.4833333194255829","0.03333333507180214","0.4166666567325592","0.0","0.4000000059604645","0.0","0.03333333507180214"
"Only in Alaska can this stuff be called normal, they will learn in time!","0.0","0.0","0.0","0.0","0.0","0.0","0.0"
