"text","toxicity","severe_toxicity","obscene","threat","insult","identity_attack","sexual_explicit"
"Jeff Sessions is another one of Trump's Orwellian choices. He believes and has believed his entire career the exact opposite of what the position requires.","0.20000000298023224","0.0","0.0","0.0","0.20000000298023224","0.0","0.0"
"I actually inspected the infrastructure on Grand Chief Stewart Philip's home Penticton First Nation in both 2010 and 2013.  Exactly Zero projects that had been identified in previous inspection reports had been funded by the federal government, and the entire band was housed in ATCO trailers.  Clearly the Harper Conservatives had already reduced the cash his band was sent to zero.","0.0","0.0","0.0","0.0","0.0","0.0","0.0"
"No it won't . That's just wishful thinking on democrats fault .   For the 100 th time , Walker cited the cost of drug users treatment as being lost with Obamacare .  I laugh every time I hear a liberal claim republicans want to hurt people , and that's why they dumped Obamacare.","0.0","0.0","0.0","0.0","0.0","0.0","0.0"
"Instead of wringing our hands and nibbling the periphery of the issue, how about we face the actual issue head on? I would support a city ordinance against loitering, and applaud city councilors who champion a real and permanent solution.

The details could be determined, but would include a limit to persons sitting, standing, lying, smoking, conversing over a certain amount of time, perhaps 10 minutes. Exceptions, of course, would be for shopping, dining, attending a licensed and approved event, etc.

It is noble to provide some services for the truly needy in our community, but that, in my estimation, is a separate issue. I do not wish for my city to provide for nor encourage idle and harassing behaviors in our city core.

Enough is enough!","0.0","0.0","0.0","0.0","0.0","0.0","0.0"
"how many of you commenters have garbage piled high in your yard, bald tires, dead batteries, rotten pallets, car parts, blah blah blah. this town is a pigpen. drive around and look for yourself, its pathetic.","0.7538461685180664","0.0","0.04615384712815285","0.0","0.7230769395828247","0.0","0.0"
"Why can't the Globe & Mail provide the symbols for these ETFs?
It is difficult to look up the precise ETF mentioned because one
 wrong word  can give you the wrong ETF.","0.0","0.0","0.0","0.0","0.0","0.0","0.0"
"That's already been happening, Carl, it's called Fake News.","0.10000000149011612","0.0","0.0","0.0","0.10000000149011612","0.0","0.0"
"imagine the costs for security, transportation, advisors tagging along, their families, groupies for this g20.  and not much is expected to be accomplished.  so why bother with the waste?","0.0","0.0","0.0","0.0","0.0","0.0","0.0"
"So they want to put United on the board of this non-profit privatized company to modernize our ATC systems?  The same United that was just fined for flying uncertified aircraft.  You want to put the airlines in charge of all ATC now when they routinely overbook flights and bounce passengers when ever they want?

As a current FAA employee that stands to make out like a bandit if they do privatize, this is inane! I'll just have to collect my military retirement, FAA retirement, and go to work maintaining the same equipment I maintain now. And no, there are no other people in the USA that has experience on AK's ""unique"" equipment. Once they do upgrade to new equipment, we will be like the lower 48 but until then, we're it.

And is the US Gov't going to give billions of dollars worth of equipment to this new company? If it fails, are we then going to buy that same equipment back?
Also, federal employees certify air safety. Civilian are not required to certify the same equipment.","0.0","0.0","0.0","0.0","0.0","0.0","0.0"
"No, no that can't be.  It's Russia that's the big hacker boogieman isn't it?  Sheesh it's so hard to remember who it is we don't want to be doing business with.  Saudi Arabia buys our weapons when they shouldn't be buying our weapons.

The Liberal party decides to sell businesses to China that are directly involved in high tech at the same time as telling us that is where our middle class jobs will come from.  Who are these people inside our government?  Do they know what Chinese workers get paid?  Do they know that they just let the wolf right inside the henhouse?

If I sound confused that's because I am.  Our government sounds more dangerous to me than anyone else.","0.4000000059604645","0.0","0.0","0.0","0.20000000298023224","0.4000000059604645","0.0"
"You're quite the one to talk after the kind of remarks you have made about indigenous peoples.","0.0","0.0","0.0","0.0","0.0","0.0","0.0"
"If it walks like a duck, and quacks like a duck....","0.5","0.0","0.0","0.0","0.5","0.0","0.0"
"At about this point: It participated with the Federation of South African Women in protests against the apartheid-era government, such as the 1952 Defiance Campaign and the Women's March of 9 August 1956.","0.0","0.0","0.0","0.0","0.0","0.0","0.0"
"In my lifetime, in my society, I've seen the power shift from male to female(e.g. check out who the school principals and university bureaucrats now are). Mr Trudeau knows it, his success is founded on his constant courting of the female voter.  And I think it's great.  

But one side-effect is that the first thing that happens is ""this is too hard, we're changing things up to make things easier, we're lowering the bar"". So people respond, and now we've got people who can't do hard stuff any more.","0.0","0.0","0.0","0.0","0.0","0.0","0.0"
"I kinda don't have a dog in the fight...except to say - Good!

Can't stand Washington...

(side note, apparently they are they largest single (negative) contributor to the stat that says the Presidents Cup winner takes home the Stanley Cup less than 30% of the time...no one else is even close. If you take them out of the equation, the number jumps something like 8-10%! if memory from the article I read is accurate...)","0.0","0.0","0.0","0.0","0.0","0.0","0.0"
"Perhaps lower reproduction rates are a choice. I don't know about you, but I'm a Millennial who considers there to be more to life than popping out a litter off young'uns. 

By the way, Canada's been sub-replacement since the early 70s. Today's fertility rates of 1.6/woman are comparable to the mid-80s, and slightly higher than 15 years ago.","0.0","0.0","0.0","0.0","0.0","0.0","0.0"
"Cancer does not have consciousness and doesn't target people intentionally to incite terror in order to impose an ideology. Extremists hate the west and our way of life, our secular society and freedoms as they try to impose their fundamentalist views through random terror attacks on innocents. Comparing terror attacks to cancer is a false equivalency, and a shameful comparison as if death by terror is trivial because relatively few die compared to cancer, implying this is an acceptable loss of life, despicable.","0.0","0.0","0.0","0.0","0.0","0.0","0.0"
"Time to base at least 2 x 61 missile MK-41 launch cells used on cruisers filled with ABM versions (102 missiles) at Barking Sands to compliment that new SPY-6 extended range radar.  This to ensure they can take multiple shots at  any inbound ballistic missiles from North Korea and create an impenetrable barrier, so it would be futile to do so again.  Yes, it would be expensive, but to protect billions upon billions of dollars of infrastructure, population, and critical military bases in Hawaii would be a no-brainer and worth it.  Even with the other type of interceptors based in Alaska, it would be smart to have this additional layer of defense.","0.20000000298023224","0.0","0.0","0.20000000298023224","0.0","0.20000000298023224","0.0"
"Wow.  Who knew there were so many Russian trolls interested in the G&M?

The inconvenient truth for our Russian friends is that their story does not hold water.  In particular, the idea that Assad innocently and accidentally bombed a cache of chemical weapons held by the rebels is completely ridiculous.  If a chemical weapons facility had been hit, the resulting explosion would most likely have caused the chemical to burn up, international weapons experts say. And a nerve agent like sarin is not likely to be stored in its active form in such a facility, and its components would need to be mixed to be lethal.","0.30000001192092896","0.0","0.0","0.0","0.20000000298023224","0.10000000149011612","0.0"
"Lol--this is funny and I am sure, intentional -> ""Your speling is terrible.""

I also appear unable to spell but normally it is from ""cat assisted"" or poor typing :)

Have a good one.","0.10000000149011612","0.0","0.0","0.0","0.20000000298023224","0.0","0.0"
"BS !","0.0","0.0","0.0","0.0","0.0","0.0","0.0"
"The council should also vote that the Hawaii ERS Pension managers be mandated to buy any local municipal bonds at full face value!","0.0","0.0","0.0","0.0","0.0","0.0","0.0"
"Students this week have been demanding a lot, shorter school days, easier classes, less homework, and shortened weeks.  Why don't we just give everyone a diploma when they reach the age of five.  Everyone is a winner there.","0.0","0.0","0.0","0.0","0.0","0.0","0.0"
"lol, cannot blame a whole class of people for the actions of one individual.  But Pocho, where are the Donald's tax returns which he promised he would release?  What a coward he has turned out to be.  Don't you agree?  I won't even mention lying, deceiving, hating.  The Donald is king in all of that.  :-)","0.0","0.0","0.0","0.0","0.0","0.0","0.0"
"Corrupt hypocrites throughout he government. Of the money, by the money and for the money. Brought to you by the jesus freaks cause birds of a feather flock together.","0.7162162065505981","0.04054053872823715","0.0810810774564743","0.0","0.7162162065505981","0.21621622145175934","0.0"
"Trust me, you're doing more due diligence on their project than they are! LOL","0.0","0.0","0.0","0.0","0.0","0.0","0.0"
"There are certain political factions that are very quick to label any valid opposition as ""hate.""  Beware of the new McCarthyist witch hunters..different ideology…same MO.","0.0","0.0","0.0","0.0","0.0","0.0","0.0"
"If the law forbids him from owning or possessing firearms, why did the court order HPD to give back his weapons after he plead guilty and was convicted of the offense they now say disqualifies him from gun ownership??","0.0","0.0","0.0","0.0","0.0","0.0","0.0"
"I'm a MYC Grad....class in mid 80's....","0.0","0.0","0.0","0.0","0.0","0.0","0.0"
"In this era of an over populated world and excessive demands for childcare paid for by tax payers, the last thing I want my money to promote is reproduction. This drama teacher is giving away far too much of our hard earned money to suit me. Now troops to the Ukraine because Freeland is Ukrainian and wants to get back at Russia. We are financing her personal battle. Apparently the Russians were not happy with her grandparents association with the Nazi's. Trudeau needs to settle down and fix Canada before doing anymore international charity work.","0.0","0.0","0.0","0.0","0.0","0.0","0.0"
"There are so many program that give our scholarships to walk-ons that don't play or never play at all.  Many players at Alabama, OSU, etc often give our scholarships to kids who have walked on for 3 years and reward them in their 4th year even though they will barely contribute.  

It's called setting a precedence.  By rewarding these kind of great kids, they work hard and it rewards kids on the scout team.  That way the scout team can attract more quality players.","0.0","0.0","0.0","0.0","0.0","0.0","0.0"
"Great article. I agree. Free trade only benefits the 1 %.

Big business is all about the shareholder, skrew the employees as they can be replaced with cheap labour, lower manufacturing environmental standards, if any, at the expense of fired employees, with free trade manufacturing in other countries. Good on Trump! Trudeau could take a few lessons from The Donald, before Trudeau experiences ""You're Fired!""; unfortunately disappointed in Trudeau; perhaps he should have stuck to boxing instead.","0.10000000149011612","0.0","0.0","0.0","0.10000000149011612","0.0","0.0"
"Right-wingers have themselves become sick and tiring. They are uncivil by definition, and, are basically just free-riders who cover themselves with self-serving language so that it might fool people into thinking that their good is the same thing as the common good.","0.20000000298023224","0.0","0.0","0.0","0.20000000298023224","0.0","0.0"
"That's is an EXCELLENT suggestion - the duties on Boeing & Airbus machines would more than offset the duties in Bombardier's exports.  It's such an obvious response, that I'm not sure why we haven't heard more people with this idea.  Maybe it's a bit early for this since the Libs seem determined to wreck any good idea that comes along, and they're otherwise a bit slow to react.","0.0","0.0","0.0","0.0","0.0","0.0","0.0"
"Why is it that the only people I ever hear talk about this book are crazy right wingers? You guys can't seem to shut up about that book!

Did it ever occur to you that the reason right-wing media continually push this book on you is that they hope you'll read it and employ its tactics to THEIR ends? Seriously, the only people I ever hear bring it up are you guys.","0.1666666716337204","0.0","0.0","0.0","0.1666666716337204","0.0","0.0"
"Ms. Smith, if the Mall smells, I suspect odors other than cigarette smoke are a contributing factor.","0.0","0.0","0.0","0.0","0.0","0.0","0.0"
"How naïve of Justin. How disingenuous of himself.

It's not the money silly.

It's being able to plant seeds of ideas, concepts, etc. in the Minister's head so that he or she will think favourably on your behalf the next time a related issue raises its ugly head.

Close quarters lobbying I would call it.","0.6000000238418579","0.0","0.0","0.0","0.5","0.0","0.0"
"Where does the demand for self driving cars come from?  Do we really have a shortage of drivers? Is this not an industry in search of a market that does not exist?","0.0","0.0","0.0","0.0","0.0","0.0","0.0"
"DNI has denied it, must be true.","0.0","0.0","0.0","0.0","0.0","0.0","0.0"
"Walker recently attended a borough council meeting and one of the things he brings up is our state's credit rating, specifically a downgrade by Moody's.
Walker says that Alaska suffered a downgrade due to the inability of the legislature to agree to his fiscal plan which basically maintains spending at current levels and the deferral of tax credits that will be over a billion dollars by this time next year. Cutting spending over increases over the last two years is clearly an attempt to pull the wool over Alaskan's eyes.
In NANA's downgrade, Moody's gives us their rationale which is liquidity driven; discourage borrowing; discourage debt. The three credit agency's have down graded our credit worthiness out of concern over spending and fiscal discipline. 
I think it's time that Walker quit spending and start sharing the truth with Alaskans.","0.0","0.0","0.0","0.0","0.0","0.0","0.0"
"Hockeytown wrote: "" Maybe wait for a little more info before casting blame on the owner.""  

What does the lack of a sprinkler system - which might have prevented the intense fire AFD referred to - have to do with where the fire started?  What I'm saying is that owners of buildings should be responsible, by law, for installing sprinklers in old buildings BEFORE there is a fire and people die.","0.0","0.0","0.0","0.0","0.0","0.0","0.0"
"Go away Carl.","0.0","0.0","0.0","0.0","0.0","0.0","0.0"
"This old Alaskan voter is darned glad Richards is on OUR side.  And for those belly-aching because they are past business associates should look before they get all knee-jerky. 
 Ohio Dan Sullivan was appointed Commissioner of the Department of Natural Resources under Parnell (before becoming the third senator from Ohio..""energy related"")
  Former attorney general John burns now works as outside counsel for AGDC..(""energy related""), and former attorney general Wilson Condon represented the state as outside counsel in the Amerada-Hess litigation after resigning his post..also ""energy related"".        It seems the CBC club and it`s masters never learn that if you live in a glass house you should never throw stones. Thank you Mr. Richards for your continued good service to your fellow Alaskans.  Time will prove we are better for it.","0.0","0.0","0.0","0.0","0.0","0.0","0.0"
"'fair and square'!
The American electoral system is so convoluted, there's no way 
of telling.
Keep religion out of it, it just complicates a complicated mess.","0.0","0.0","0.0","0.0","0.0","0.0","0.0"
"“If we can help little #CharlieGard, as per our friends in the UK and the Pope, we would be delighted to do so,” the US president tweeted.""

“Our hearts weep for #CharlieGard,” the conservative senator Ted Cruz tweeted. 

The head of bioethics at New York University Langone Medical Center, Arthur Caplan, called for politicians such as Cruz and Trump to put their money where their mouth is.

“Those such as President Trump who say they want to help Charlie should be telling us what they are budgeting to expand access to healthcare including both novel experimental interventions and proven treatments for all American kids,” he wrote in the Hill. “Anything less,” he said, “is just empty, feel-good, cheap politician hot air.”

https://www.theguardian.com/uk-news/2017/jul/26/charlie-gard-us-pro-life-rightwing-ethics","0.0","0.0","0.0","0.0","0.0","0.0","0.0"
"We need a national set of firearm regulations instead of 50 different, and confusing ones.","0.0","0.0","0.0","0.0","0.0","0.0","0.0"
"Hodad...does your user handle refer to your daughter??","0.0","0.0","0.0","0.0","0.0","0.0","0.0"
"Give me one workable policy change that would enact your vision.","0.0","0.0","0.0","0.0","0.0","0.0","0.0"
"Right, they all impose their views on others","0.0","0.0","0.0","0.0","0.0","0.0","0.0"
"Alf, is there really a difference in the ANC between doing the wrong thing and walking the party line? They sound like pretty much the same thing?! :-)","0.0","0.0","0.0","0.0","0.0","0.0","0.0"
"So 95% is not enough?  Should it be 100%","0.0","0.0","0.0","0.0","0.0","0.0","0.0"
"I'm your pal, Silverhorn?  I'd say I was touched but based on your politics ""touched"" applies to you more than me.  Just joking :).  You seem to understand there's a problem with the future society is heading for due to automation.  You seem to scorn some possible solutions, likely for no other reason than you disagree in general with myself and Lynn.  You don't seem fond of the notion of rioting in the streets.  So what do we do in your opinion?  What alternative do we have to being plowed under by a mindless rush to strip the cost of labor from the cost of production without replacing the very income necessary for people to make in order to consume products and services?
Liberals and Conservatives could actually have meaningful economic discussions if Conservatives would accept the fact that economic systems belong to all members of society and that it doesn't matter how economies are organized as long as they achieve the purpose of providing necessities for all.","0.0","0.0","0.0","0.0","0.0","0.0","0.0"
"Not so funny thing - North Korea propaganda is stating that a mad man like Trump cannot be appealed to with dialogue or reason - ""only absolute force"" can work on him.

If I had a nickle for every US President and/or right winger who made the same argument about every single ""just like Hitler"" foe they dredged up to motivate the populace for war - I'd be very rich.

Do either Trump or Kim Jong Un realize we are all downwind from the radioactive fall out of nuclear war.","0.0","0.0","0.0","0.0","0.0","0.0","0.0"
"And yet what do republicans offer?  NOTHINGD!  Please don't forget that they ran Hawaii for the 50 year prior to democrats taking over in 1954.  On the national level, what have reepublicans done?  Basically nothing since Eisenhower, (Interstate freeway system) and Nixon (first proposed Obama care)

Frankly tired of these fake conservatives.","0.1666666716337204","0.0","0.0","0.0","0.1666666716337204","0.0","0.0"
"This ""review"" sounds more like an attack from a very spoiled bully. Good thing I now know not to pay any attention to any of Dan Clapsons' opinions,  he couldn't get any pettier if he tried.","0.4000000059604645","0.0","0.0","0.0","0.4000000059604645","0.0","0.0"
"Fool.","0.734375","0.015625","0.0625","0.0","0.71875","0.0","0.0"
"While I know you'e trying to push buttons, let me point out that you are correct in your statement about these types of crimes. The majority of these types of crime are committed by whites.  Please be honest and tell us what race the majority of the violent crimes are committed by. No one said anything about whites being innocent. We all have our bad eggs.","0.5","0.0","0.20000000298023224","0.0","0.5","0.4000000059604645","0.20000000298023224"
"Motley:  this is an interesting topic.  Certainly, pedophiles often seek positions where they can find and groom potential victims.  Yes, scout leaders, teachers, coaches, church youth group leaders, Catholic priests, vounteers to youth assistance programs, et al.  It's also interesting that the Boy Scouts have long prohibited gay men from serving as Scout leaders.  Yet, the organization has a long history of ""non-gay"" leaders being pedophiles... Folllowing is a quotation from an excellent article addressing this issue.  I've also provided the link so you or anyone else can read the entire article.  regards, Gary Crum","0.5","0.0","0.10000000149011612","0.0","0.30000001192092896","0.4000000059604645","0.0"
"[Its also served certain assembly members well who have collected lots of contributions from cab company owners.]
Source?","0.0","0.0","0.0","0.0","0.0","0.0","0.0"
"""Because of the lack of action in Congress, Hawaii will run out of CHIP funding by the end of 2017, and Natalie will have her autism care interrupted until her family finds insurance in some other way.""  This is nonsense.  Don't blame it on Congress.  If Hawaii can afford to add .05% to the GET to raise billions of dollars for nice-to-have rail, it surely can afford to add another .05% for essentials like CHIP to take care of its own.","0.0","0.0","0.0","0.0","0.0","0.0","0.0"
"One only needed to read the police reports that the Register Guard posted, to easily see that these men engaged in extremely inappropriate behavior.  As best as I can remember from the RG, they freely admitted to engaging in unbecoming and offensive behavior to the police.   The fact that the behavior could not be shown to have been illegal and broken the law, is beside the point.

Tell me, would you like for your own sister or daughter to have been taken drunk into a bathroom, and treated like that?   Normal people find such behavior to be shocking and immoral.   Even if there was consent.

So I say so what if the Register Guard tried and convicted the men in the court of public opinion?   I found their articles to be very credible and convincing.   No bad journalism at all there, in my opinion.   The RG reporting certainly convinced me that these men were a discredit to the University.

They may have put much more into reporting this case than other media.  But is that a bad thing?","0.0","0.0","0.0","0.0","0.0","0.0","0.0"
"Not so!  Congress went through that intersection on Nov. 8, now a the road to. . .","0.0","0.0","0.0","0.0","0.0","0.0","0.0"
"I keep seeing your name but can't read any of your comments because <this comment did not meet civility standards> 
There's like 10+ of these under your name on this article alone. What's the point of making soo many comments if nobody can read them?","0.0","0.0","0.0","0.0","0.0","0.0","0.0"
"The City Hall fiasco, all the MUPTEs, etc. have gotten the attention of many;  I agree that trust in city government is at all time low.","0.0","0.0","0.0","0.0","0.0","0.0","0.0"
"I was under the impression they ceased to live in this area but after re reading the article it says many communities waned but continued to exist. I would agree that the Thule and Inuit are one in the same. As I understand at one time Pt Hope was one of the largest villages in the Arctic with close to a thousand homes and a center point for trade and commerce. Unfortunately much of the old village has eroded into the sea. 
I wonder how far inland they penetrated and the extent of the contact the Thule had with other native cultures.","0.0","0.0","0.0","0.0","0.0","0.0","0.0"
"Did Mark Shore lose his job? I have not seen his guff for quite a while now.","0.1666666716337204","0.0","0.0","0.0","0.1666666716337204","0.0","0.0"
"Loosing friends and family to drug overdoses is very sad. Publicizing that people die from it helps educate kids to the real dangers of Heroin, and other drugs. There is a heroin epidemic and little or no rehabilitation facilities. This isn't a political problem we need Rehab facilities for people who want to quit and for people convicted of low level drug crimes. Ignoring the problem will not solve it, and polarizing it politically is ignorant and destructive to society.","0.6000000238418579","0.10000000149011612","0.10000000149011612","0.0","0.6000000238418579","0.0","0.0"
"""Indeed, the more money that flows into housing, the less flows into stocks, bonds or banks.""

What a dumb statement. Money spent on home improvement goes to businesses and then banks. In many places, like Eugene, rent is the same as a mortgage. The writing is making the ASSumption that if you don't buy a house, you'll somehow automatically be flush with cash. If only the rental market reflected that naive optimism.","0.0","0.0","0.0","0.0","0.0","0.0","0.0"
"Wanna bet?","0.0","0.0","0.0","0.0","0.0","0.0","0.0"
